timestamp_iso,site_name,product_name,sku,product_url,status,price_value,currency,raw_price_text,source_url,notes
2026-07-13T19:08:38.617951+00:00,shamystores.com,Buy Final Fantasy Xvi Used in Egypt | Shamy Stores,,https://shamystores.com/products/outlet-final-fantasy-xvi-used,Available,1750.0,EGP,"Sale priceFrom 1,750 EGP",https://shamystores.com,heuristic
2026-07-13T19:09:26.606576+00:00,shamystores.com,Buy Ac Adapter Dobe for Switch in Egypt | Shamy Stores,,https://shamystores.com/products/ac-adapter-dobe-for-switch-tns-5159,Out of Stock,450.0,EGP,Sale price450 EGP,https://shamystores.com/collections/all,heuristic
2026-07-13T19:09:26.687808+00:00,shamystores.com,Save 100 Sale price Regular price Anker PowerLine Select+ Lightning Cable Black (6ft) Anker Sold out Sold out Quick view,,https://shamystores.com/products/anker-powerline-select-lightning-cable-black-6ft,Out of Stock,290.0,EGP,Sale price290 EGP,https://shamystores.com/collections/all,heuristic
2026-07-13T19:10:12.594577+00:00,shamystores.com,Buy Controller Performance Thumb Grips in Egypt | Shamy Stores,,https://shamystores.com/products/controller-performance-thumb-grips-41014003056437,Available,175.0,EGP,Sale price175 EGP,https://shamystores.com/collections/accessories,heuristic
2026-07-13T19:10:12.627835+00:00,shamystores.com,Buy Onikuma K1b Gaming Headset in Egypt | Shamy Stores,,https://shamystores.com/products/onikuma-k1b-gaming-headset-41014003057239,Available,690.0,EGP,Sale price690 EGP,https://shamystores.com/collections/accessories,heuristic
2026-07-13T19:11:43.714435+00:00,shamystores.com,Buy Final Fantasy Vii Rebirth in Egypt | Shamy Stores,,https://shamystores.com/products/final-fantasy-vii-rebirth-used,Out of Stock,1900.0,EGP,"Sale price1,900 EGP",https://shamystores.com/collections/ps5-used-games?page=2,heuristic
2026-07-13T19:12:29.640003+00:00,shamystores.com,Delivery Only Sale price From Final Fantasy VII Remake Intergrade Used Square Enix Sold out Sold out Quick view,,https://shamystores.com/products/final-fantasy-vii-remake-intergrade-used-40015002045221,Out of Stock,600.0,EGP,Sale priceFrom 600 EGP,https://shamystores.com/collections/ps5-used-games?page=3,heuristic
2026-07-13T19:14:48.428186+00:00,shamystores.com,Buy Baseus Cloud Gel Protective Case for Airpods Pro in Egypt | Shamy Stores,,https://shamystores.com/products/baseus-cloud-gel-protective-case-for-airpods-pro,Available,240.0,EGP,Sale price240 EGP,https://shamystores.com/collections/all?page=3,heuristic
2026-07-13T19:16:20.246563+00:00,shamystores.com,Buy Onikuma K8 Headset in Egypt | Shamy Stores,,https://shamystores.com/products/onikuma-k8-headset,Available,790.0,EGP,Sale price790 EGP,https://shamystores.com/collections/accessories?page=2,heuristic
2026-07-13T19:16:20.256607+00:00,shamystores.com,YESIDO C226 Phone Cooler with Temperature Display – New,,https://shamystores.com/products/yesido-c226-phone-cooler,Available,690.0,EGP,Sale price690 EGP,https://shamystores.com/collections/accessories?page=2,heuristic
2026-07-13T19:16:20.315334+00:00,shamystores.com,Buy Dobe Protective Shell for Switch Pro Controller in Egypt | Shamy Stores,,https://shamystores.com/products/dobe-protective-shell-for-switch-pro-controller-41021003056365,Available,190.0,EGP,Sale price190 EGP,https://shamystores.com/collections/accessories?page=2,heuristic
2026-07-13T19:16:20.320389+00:00,shamystores.com,Controller Cases & Protection Collection,,https://shamystores.com/products/controller-cases,Available,690.0,EGP,Sale price690 EGP,https://shamystores.com/collections/accessories?page=2,heuristic
2026-07-13T19:17:06.111317+00:00,shamystores.com,ONIKUMA CW905 Gaming Mouse – New,,https://shamystores.com/products/onikuma-cw905-gaming-mouse,Available,790.0,EGP,Sale price790 EGP,https://shamystores.com/collections/accessories?page=3,heuristic
2026-07-13T19:17:06.116240+00:00,shamystores.com,ONIKUMA CW902 Gaming Mouse – New,,https://shamystores.com/products/onikuma-cw902-gaming-mouse,Available,590.0,EGP,Sale price590 EGP,https://shamystores.com/collections/accessories?page=3,heuristic
2026-07-13T19:17:06.132174+00:00,shamystores.com,Charging CabM DOBE for Switch (TNS-5166),,https://shamystores.com/products/dobe-charging-cable-1-5m-for-switch-tns-5166,Available,290.0,EGP,Sale price290 EGP,https://shamystores.com/collections/accessories?page=3,heuristic
2026-07-13T19:17:06.137075+00:00,shamystores.com,Buy Dobe Silicon Protective Case for Switch 2 in Egypt | Shamy Stores,,https://shamystores.com/products/dobe-silicon-protective-case-for-switch-2-tns-3158,Available,490.0,EGP,Sale price490 EGP,https://shamystores.com/collections/accessories?page=3,heuristic
2026-07-13T19:17:06.146896+00:00,shamystores.com,Buy Crystal Case Dobe for Joy-con Switch Oled in Egypt | Shamy Stores,,https://shamystores.com/products/crystal-case-dobe-joy-con-switch-oled,Available,390.0,EGP,Sale price390 EGP,https://shamystores.com/collections/accessories?page=3,heuristic
2026-07-13T19:17:06.161659+00:00,shamystores.com,Buy Multifunctional Storage Stand Dobe All Switch in Egypt | Shamy Stores,,https://shamystores.com/products/multifunctional-storage-stand-dobe-all-switch-tns-19051b,Available,790.0,EGP,Sale price790 EGP,https://shamystores.com/collections/accessories?page=3,heuristic
2026-07-13T19:17:06.181434+00:00,shamystores.com,Buy Dobe Wall Mount Bundle for All Switch in Egypt | Shamy Stores,,https://shamystores.com/products/dobe-wall-mount-bundle-switch-tns-3113,Available,1190.0,EGP,"Sale price1,190 EGP",https://shamystores.com/collections/accessories?page=3,heuristic
2026-07-13T19:17:06.186385+00:00,shamystores.com,Buy Crystal Case Dobe for Switch 2 in Egypt | Shamy Stores,,https://shamystores.com/products/crystal-case-dobe-switch-2,Available,550.0,EGP,Sale price550 EGP,https://shamystores.com/collections/accessories?page=3,heuristic
2026-07-13T19:17:06.244038+00:00,shamystores.com,Buy Baseus Cloud Gel Protective Case for Airpods Pro in Egypt | Shamy Stores,,https://shamystores.com/products/baseus-cloud-gel-protective-case-for-airpods-pro,Available,240.0,EGP,Sale price240 EGP,https://shamystores.com/collections/accessories?page=3,heuristic
2026-07-13T19:17:51.857671+00:00,shamystores.com,Buy Hp S1000 Plus Wireless Mouse in Egypt | Shamy Stores,,https://shamystores.com/products/hp-s1000-plus-wireless-mouse,Out of Stock,250.0,EGP,Sale price250 EGP,https://shamystores.com/collections/accessories?page=7,heuristic
2026-07-13T19:17:51.860413+00:00,shamystores.com,Save 100 Sale price Regular price Redragon K506 Centaur 7-Color Gaming Keyboard Redragon Sold out Sold out Quick view,,https://shamystores.com/products/redragon-k506-centaur-7-color-gaming-keyboard,Out of Stock,690.0,EGP,Sale price690 EGP,https://shamystores.com/collections/accessories?page=7,heuristic
2026-07-13T19:17:51.898561+00:00,shamystores.com,Buy Redragon Kumara K552 Keyboard in Egypt | Shamy Stores,,https://shamystores.com/products/redragon-kumara-k552-keyboard-41010003057578,Out of Stock,1790.0,EGP,"Sale price1,790 EGP",https://shamystores.com/collections/accessories?page=7,heuristic
2026-07-13T19:17:51.901096+00:00,shamystores.com,Special Bundle Sale price Redragon M601-BA Gaming Mouse and Mouse Pad Kit Redragon Sold out Sold out Quick view,,https://shamystores.com/products/redragon-m601-ba-gaming-mouse-and-pad-kit-41010003058001,Out of Stock,450.0,EGP,Sale price450 EGP,https://shamystores.com/collections/accessories?page=7,heuristic
2026-07-13T19:17:51.906054+00:00,shamystores.com,Buy Redragon M705 Pegasus Gaming Mouse Pegasus in Egypt | Shamy Stores,,https://shamystores.com/products/redragon-m705-pegasus-gaming-mouse-41010003057606,Out of Stock,890.0,EGP,Sale price890 EGP,https://shamystores.com/collections/accessories?page=7,heuristic
2026-07-13T19:18:37.540535+00:00,shamystores.com,Buy Final Fantasy Xvi Used in Egypt | Shamy Stores,,https://shamystores.com/products/outlet-final-fantasy-xvi-used,Available,1750.0,EGP,"Sale priceFrom 1,750 EGP",https://shamystores.com/collections/ps5-used-games?page=1,heuristic
2026-07-13T19:19:23.361548+00:00,shamystores.com,Buy Ac Adapter Dobe for Switch in Egypt | Shamy Stores,,https://shamystores.com/products/ac-adapter-dobe-for-switch-tns-5159,Out of Stock,450.0,EGP,Sale price450 EGP,https://shamystores.com/collections/all?page=1,heuristic
2026-07-13T19:19:23.440894+00:00,shamystores.com,Save 100 Sale price Regular price Anker PowerLine Select+ Lightning Cable Black (6ft) Anker Sold out Sold out Quick view,,https://shamystores.com/products/anker-powerline-select-lightning-cable-black-6ft,Out of Stock,290.0,EGP,Sale price290 EGP,https://shamystores.com/collections/all?page=1,heuristic
2026-07-13T19:20:55.106599+00:00,shamystores.com,Buy Cable Hdmi Normal 5m in Egypt | Shamy Stores,,https://shamystores.com/products/cable-hdmi-normal-5m-4102060,Out of Stock,120.0,EGP,Sale price120 EGP,https://shamystores.com/collections/all?page=5,heuristic
2026-07-13T19:21:40.870506+00:00,shamystores.com,YESIDO C226 Phone Cooler with Temperature Display – New,,https://shamystores.com/products/yesido-c226-phone-cooler,Available,690.0,EGP,Sale price690 EGP,https://shamystores.com/collections/all?page=54,heuristic
2026-07-13T19:21:40.875431+00:00,shamystores.com,YESIDO EK01 Gaming Headset – New,,https://shamystores.com/products/yesido-ek01-gaming-headset,Out of Stock,1190.0,EGP,"Sale price1,190 EGP",https://shamystores.com/collections/all?page=54,heuristic
2026-07-13T19:23:12.344511+00:00,shamystores.com,Buy Controller Performance Thumb Grips in Egypt | Shamy Stores,,https://shamystores.com/products/controller-performance-thumb-grips-41014003056437,Available,175.0,EGP,Sale price175 EGP,https://shamystores.com/collections/accessories?page=1,heuristic
2026-07-13T19:23:12.377935+00:00,shamystores.com,Buy Onikuma K1b Gaming Headset in Egypt | Shamy Stores,,https://shamystores.com/products/onikuma-k1b-gaming-headset-41014003057239,Available,690.0,EGP,Sale price690 EGP,https://shamystores.com/collections/accessories?page=1,heuristic
2026-07-13T19:23:57.985896+00:00,shamystores.com,Buy Controller Charging Stand in Egypt | Shamy Stores,,https://shamystores.com/products/controller-charging-stand-041014003055982,Out of Stock,120.0,EGP,Sale price120 EGP,https://shamystores.com/collections/accessories?page=4,heuristic
2026-07-13T19:23:58.057877+00:00,shamystores.com,Buy Redragon K565 Rudra Rainbow Mechanical Gaming Keyboard in Egypt | Shamy Stores,,https://shamystores.com/products/redragon-k565-rudra-rainbow-mechanical-gaming-keyboard-41010003057737,Out of Stock,590.0,EGP,Sale price590 EGP,https://shamystores.com/collections/accessories?page=4,heuristic
2026-07-13T19:23:58.062935+00:00,shamystores.com,Spider-Man 2 Controller Carry Case – New (Universal Controllers),,https://shamystores.com/products/spiderman-controller-case,Out of Stock,490.0,EGP,Sale price490 EGP,https://shamystores.com/collections/accessories?page=4,heuristic
2026-07-13T19:23:58.088036+00:00,shamystores.com,Buy Redragon K552 Kumara Led Backlit Mechanical Gaming Keyboard in Egypt | Shamy Stores,,https://shamystores.com/products/redragon-k552-kumara-led-backlit-mechanical-gaming-keyboard,Out of Stock,1890.0,EGP,"Sale price1,890 EGP",https://shamystores.com/collections/accessories?page=4,heuristic
2026-07-13T19:23:58.098583+00:00,shamystores.com,Save 100 Sale price Regular price Anker PowerLine Select+ Lightning Cable Black (6ft) Anker Sold out Sold out Quick view,,https://shamystores.com/products/anker-powerline-select-lightning-cable-black-6ft,Out of Stock,290.0,EGP,Sale price290 EGP,https://shamystores.com/collections/accessories?page=4,heuristic
2026-07-13T19:23:58.108742+00:00,shamystores.com,JSAUX Battle Armor Protective Case – New (Switch 2),,https://shamystores.com/products/jsaux-battle-armor-case-switch-2,Out of Stock,890.0,EGP,Sale price890 EGP,https://shamystores.com/collections/accessories?page=4,heuristic
2026-07-13T19:24:43.738488+00:00,shamystores.com,Buy Dobe Stereo Headphone Small Ty-1802 in Egypt | Shamy Stores,,https://shamystores.com/products/dobe-stereo-headphone-small-ty180,Out of Stock,590.0,EGP,Sale price590 EGP,https://shamystores.com/collections/accessories?page=5,heuristic
2026-07-13T19:24:43.799533+00:00,shamystores.com,Buy Redragon Phaser M609 Gaming Mouse in Egypt | Shamy Stores,,https://shamystores.com/products/redragon-phaser-m609-gaming-mouse-41010003057988,Out of Stock,690.0,EGP,Sale price690 EGP,https://shamystores.com/collections/accessories?page=5,heuristic
2026-07-13T19:24:43.804478+00:00,shamystores.com,Buy Cable Hdmi Normal 5m in Egypt | Shamy Stores,,https://shamystores.com/products/cable-hdmi-normal-5m-4102060,Out of Stock,120.0,EGP,Sale price120 EGP,https://shamystores.com/collections/accessories?page=5,heuristic
2026-07-13T19:24:43.809502+00:00,shamystores.com,YESIDO EK01 Gaming Headset – New,,https://shamystores.com/products/yesido-ek01-gaming-headset,Out of Stock,1190.0,EGP,"Sale price1,190 EGP",https://shamystores.com/collections/accessories?page=5,heuristic
2026-07-13T19:24:43.841953+00:00,shamystores.com,Buy Ac Adapter Dobe for Switch in Egypt | Shamy Stores,,https://shamystores.com/products/ac-adapter-dobe-for-switch-tns-5159,Out of Stock,450.0,EGP,Sale price450 EGP,https://shamystores.com/collections/accessories?page=5,heuristic
2026-07-13T19:24:43.864343+00:00,shamystores.com,Buy Dobe Storage Case for Switch 2 in Egypt | Shamy Stores,,https://shamystores.com/products/obe-storage-case-switch-2,Out of Stock,1690.0,EGP,"Sale price1,690 EGP",https://shamystores.com/collections/accessories?page=5,heuristic
2026-07-13T19:41:19.118218+00:00,compumarts.com,GIGABYTE X870E EAGLE X3D WIFI7 ATX AM5 Motherboard DDR5 PCIe 5.0 USB4 Wi-Fi 7 5GbE LAN,,https://compumarts.com/collections/new-arrivel-accessories-%F0%9F%8E%A7/products/gigabyte-x870e-eagle-x3d-wifi7-am5-ddr5-pcie-5-0-egypt,Available,870.0,EGP,GIGABYTE X870E EAGLE X3D WIFI7 ATX AM5 Motherboard DDR5 PCIe 5.0 USB4 Wi-Fi 7 5GbE LAN,https://compumarts.com,heuristic
2026-07-13T19:41:19.127080+00:00,compumarts.com,GIGABYTE B650EM FORCE WIFI6E Motherboard AMD Socket AM5 Micro ATX DDR5,,https://compumarts.com/collections/new-arrivel-accessories-%F0%9F%8E%A7/products/gigabyte-b650em-force-wifi6e-motherboard-egypt,Available,650.0,EGP,GIGABYTE B650EM FORCE WIFI6E Motherboard AMD Socket AM5 Micro ATX DDR5,https://compumarts.com,heuristic
2026-07-13T19:41:19.135873+00:00,compumarts.com,GIGABYTE B650EM DS3H WIFI6E Motherboard AMD Socket AM5 Micro ATX DDR5,,https://compumarts.com/collections/new-arrivel-accessories-%F0%9F%8E%A7/products/gigabyte-b650em-ds3h-wifi6e-motherboard-egypt,Available,650.0,EGP,GIGABYTE B650EM DS3H WIFI6E Motherboard AMD Socket AM5 Micro ATX DDR5,https://compumarts.com,heuristic
2026-07-13T19:41:19.144636+00:00,compumarts.com,GIGABYTE B840M H Micro ATX Motherboard AMD Socket AM5 DDR5 128GB,,https://compumarts.com/collections/new-arrivel-accessories-%F0%9F%8E%A7/products/gigabyte-b840m-h-micro-atx-motherboard-egypt,Available,840.0,EGP,GIGABYTE B840M H Micro ATX Motherboard AMD Socket AM5 DDR5 128GB,https://compumarts.com,heuristic
2026-07-13T19:41:19.160616+00:00,compumarts.com,GIGABYTE B840M D3HP WIFI6E Micro ATX Motherboard AMD Socket AM5 DDR5 Wi-Fi 6E,,https://compumarts.com/collections/new-arrivel-accessories-%F0%9F%8E%A7/products/gigabyte-b840m-d3hp-wifi6e-micro-atx-motherboard-egypt,Available,840.0,EGP,GIGABYTE B840M D3HP WIFI6E Micro ATX Motherboard AMD Socket AM5 DDR5 Wi-Fi 6E,https://compumarts.com,heuristic
2026-07-13T19:41:19.167725+00:00,compumarts.com,"GIGABYTE B850M FORCE WIFI6E Micro ATX Motherboard for AMD AM5 with AMD B850 Chipset, DDR5 Support, Wi-Fi 6E, Bluetooth 5.3, PCIe 5.0, HDMI & DisplayPort",,https://compumarts.com/collections/new-arrivel-accessories-%F0%9F%8E%A7/products/gigabyte-b850m-force-wifi6e-motherboard-am5-ddr5-b850-egypt,Available,850.0,EGP,"GIGABYTE B850M FORCE WIFI6E Micro ATX Motherboard for AMD AM5 with AMD B850 Chipset, DDR5 Support, Wi-Fi 6E, Bluetooth 5.3, PCIe 5.0, HDMI & DisplayPort",https://compumarts.com,heuristic
2026-07-13T19:41:19.174797+00:00,compumarts.com,"X870M AORUS ELITE WIFI7 Micro ATX Motherboard for AMD Socket AM5 with AMD X870 Chipset, DDR5 Support, Wi-Fi 7, USB4, PCIe 5.0",,https://compumarts.com/collections/new-arrivel-accessories-%F0%9F%8E%A7/products/x870m-aorus-elite-wifi7-motherboard-am5-ddr5-pcie-5-0-egypt,Available,870.0,EGP,"X870M AORUS ELITE WIFI7 Micro ATX Motherboard for AMD Socket AM5 with AMD X870 Chipset, DDR5 Support, Wi-Fi 7, USB4, PCIe 5.0",https://compumarts.com,heuristic
2026-07-13T19:41:19.183566+00:00,compumarts.com,GIGABYTE B840M DS3H WIFI6 Micro ATX Motherboard AMD Socket AM5 DDR5 Wi-Fi 6,,https://compumarts.com/collections/new-arrivel-accessories-%F0%9F%8E%A7/products/gigabyte-b840m-ds3h-wifi6-micro-atx-motherboard-egypt,Available,840.0,EGP,GIGABYTE B840M DS3H WIFI6 Micro ATX Motherboard AMD Socket AM5 DDR5 Wi-Fi 6,https://compumarts.com,heuristic
2026-07-13T19:41:19.192363+00:00,compumarts.com,GIGABYTE B840M GAMING X WIFI6E Micro ATX Motherboard AMD Socket AM5 DDR5 Wi-Fi 6E,,https://compumarts.com/collections/new-arrivel-accessories-%F0%9F%8E%A7/products/gigabyte-b840m-gaming-x-wifi6e-micro-atx-motherboard-egypt,Available,840.0,EGP,GIGABYTE B840M GAMING X WIFI6E Micro ATX Motherboard AMD Socket AM5 DDR5 Wi-Fi 6E,https://compumarts.com,heuristic
2026-07-13T19:41:19.201144+00:00,compumarts.com,"GIGABYTE B760 DS3H GEN5 ATX Motherboard for LGA1700 Intel Processors with DDR5 Support, PCIe 5.0 x16, Dual M.2 PCIe 4.0 and USB 3.2 Gen 2x2",,https://compumarts.com/collections/new-arrivel-accessories-%F0%9F%8E%A7/products/gigabyte-b760-ds3h-gen5-motherboard-lga1700-ddr5-pcie5-egypt,Available,760.0,EGP,"GIGABYTE B760 DS3H GEN5 ATX Motherboard for LGA1700 Intel Processors with DDR5 Support, PCIe 5.0 x16, Dual M.2 PCIe 4.0 and USB 3.2 Gen 2x2",https://compumarts.com,heuristic
2026-07-13T19:41:19.213425+00:00,compumarts.com,GIGABYTE B840M A ELITE WIFI6E Micro ATX Motherboard AMD Socket AM5 DDR5 Wi-Fi 6E,,https://compumarts.com/collections/new-arrivel-accessories-%F0%9F%8E%A7/products/gigabyte-b840m-a-elite-wifi6e-micro-atx-motherboard-egypt,Available,840.0,EGP,GIGABYTE B840M A ELITE WIFI6E Micro ATX Motherboard AMD Socket AM5 DDR5 Wi-Fi 6E,https://compumarts.com,heuristic
2026-07-13T19:41:19.222269+00:00,compumarts.com,GIGABYTE H810M H Rev. 1.0 Micro ATX Motherboard LGA1851 DDR5 PCIe 4.0,,https://compumarts.com/collections/new-arrivel-accessories-%F0%9F%8E%A7/products/products-gigabyte-h810m-h-lga1851-ddr5-micro-atx-motherboard,Available,810.0,EGP,GIGABYTE H810M H Rev. 1.0 Micro ATX Motherboard LGA1851 DDR5 PCIe 4.0,https://compumarts.com,heuristic
2026-07-13T19:41:19.231086+00:00,compumarts.com,"GIGABYTE X870E AORUS XTREME AI TOP E-ATX AM5 Motherboard with AMD X870E, DDR5, PCIe 5.0, USB4, Wi-Fi 7, Dual 10GbE LAN",,https://compumarts.com/collections/new-arrivel-accessories-%F0%9F%8E%A7/products/products-gigabyte-x870e-aorus-xtreme-ai-top-am5-ddr5-pcie-5-motherboard-egypt,Available,870.0,EGP,"GIGABYTE X870E AORUS XTREME AI TOP  E-ATX AM5 Motherboard with AMD X870E, DDR5, PCIe 5.0, USB4, Wi-Fi 7, Dual 10GbE LAN",https://compumarts.com,heuristic
2026-07-13T19:41:19.239896+00:00,compumarts.com,"GIGABYTE B760M AORUS ELITE DDR4 GEN5 Micro ATX Motherboard – LGA1700, Intel B760, DDR4 128GB, PCIe 5.0, Dual M.2 PCIe 4.0, 2.5GbE LAN",,https://compumarts.com/collections/new-arrivel-accessories-%F0%9F%8E%A7/products/gigabyte-b760m-aorus-elite-ddr4-lga1700-pcie5-egypt,Available,760.0,EGP,"GIGABYTE B760M AORUS ELITE DDR4 GEN5 Micro ATX Motherboard – LGA1700, Intel B760, DDR4 128GB, PCIe 5.0, Dual M.2 PCIe 4.0, 2.5GbE LAN",https://compumarts.com,heuristic
2026-07-13T19:41:19.248676+00:00,compumarts.com,GIGABYTE B840 EAGLE WF6E ATX Motherboard AMD Socket AM5 DDR5 Wi-Fi 6E,,https://compumarts.com/collections/new-arrivel-accessories-%F0%9F%8E%A7/products/gigabyte-b840-eagle-wf6e-atx-motherboard-egypt,Available,840.0,EGP,GIGABYTE B840 EAGLE WF6E ATX Motherboard AMD Socket AM5 DDR5 Wi-Fi 6E,https://compumarts.com,heuristic
2026-07-13T19:41:19.257490+00:00,compumarts.com,GIGABYTE X870E EAGLE X3D WIFI7 ATX AM5 Motherboard DDR5 PCIe 5.0 USB4 Wi-Fi 7 5GbE LAN,,https://compumarts.com/collections/new-arrivel-accessories-%F0%9F%8E%A7/products/gigabyte-x870e-eagle-x3d-wifi7-am5-ddr5-pcie-5-0-egypt,Available,870.0,EGP,GIGABYTE X870E EAGLE X3D WIFI7 ATX AM5 Motherboard DDR5 PCIe 5.0 USB4 Wi-Fi 7 5GbE LAN,https://compumarts.com,heuristic
2026-07-13T19:41:19.266268+00:00,compumarts.com,GIGABYTE B650EM FORCE WIFI6E Motherboard AMD Socket AM5 Micro ATX DDR5,,https://compumarts.com/collections/new-arrivel-accessories-%F0%9F%8E%A7/products/gigabyte-b650em-force-wifi6e-motherboard-egypt,Available,650.0,EGP,GIGABYTE B650EM FORCE WIFI6E Motherboard AMD Socket AM5 Micro ATX DDR5,https://compumarts.com,heuristic
2026-07-13T19:41:19.275074+00:00,compumarts.com,GIGABYTE B650EM DS3H WIFI6E Motherboard AMD Socket AM5 Micro ATX DDR5,,https://compumarts.com/collections/new-arrivel-accessories-%F0%9F%8E%A7/products/gigabyte-b650em-ds3h-wifi6e-motherboard-egypt,Available,650.0,EGP,GIGABYTE B650EM DS3H WIFI6E Motherboard AMD Socket AM5 Micro ATX DDR5,https://compumarts.com,heuristic
2026-07-13T19:41:19.283830+00:00,compumarts.com,GIGABYTE B840M H Micro ATX Motherboard AMD Socket AM5 DDR5 128GB,,https://compumarts.com/collections/new-arrivel-accessories-%F0%9F%8E%A7/products/gigabyte-b840m-h-micro-atx-motherboard-egypt,Available,840.0,EGP,GIGABYTE B840M H Micro ATX Motherboard AMD Socket AM5 DDR5 128GB,https://compumarts.com,heuristic
2026-07-13T19:41:19.299707+00:00,compumarts.com,GIGABYTE B840M D3HP WIFI6E Micro ATX Motherboard AMD Socket AM5 DDR5 Wi-Fi 6E,,https://compumarts.com/collections/new-arrivel-accessories-%F0%9F%8E%A7/products/gigabyte-b840m-d3hp-wifi6e-micro-atx-motherboard-egypt,Available,840.0,EGP,GIGABYTE B840M D3HP WIFI6E Micro ATX Motherboard AMD Socket AM5 DDR5 Wi-Fi 6E,https://compumarts.com,heuristic
2026-07-13T19:41:19.306773+00:00,compumarts.com,"GIGABYTE B850M FORCE WIFI6E Micro ATX Motherboard for AMD AM5 with AMD B850 Chipset, DDR5 Support, Wi-Fi 6E, Bluetooth 5.3, PCIe 5.0, HDMI & DisplayPort",,https://compumarts.com/collections/new-arrivel-accessories-%F0%9F%8E%A7/products/gigabyte-b850m-force-wifi6e-motherboard-am5-ddr5-b850-egypt,Available,850.0,EGP,"GIGABYTE B850M FORCE WIFI6E Micro ATX Motherboard for AMD AM5 with AMD B850 Chipset, DDR5 Support, Wi-Fi 6E, Bluetooth 5.3, PCIe 5.0, HDMI & DisplayPort",https://compumarts.com,heuristic
2026-07-13T19:41:19.313872+00:00,compumarts.com,"X870M AORUS ELITE WIFI7 Micro ATX Motherboard for AMD Socket AM5 with AMD X870 Chipset, DDR5 Support, Wi-Fi 7, USB4, PCIe 5.0",,https://compumarts.com/collections/new-arrivel-accessories-%F0%9F%8E%A7/products/x870m-aorus-elite-wifi7-motherboard-am5-ddr5-pcie-5-0-egypt,Available,870.0,EGP,"X870M AORUS ELITE WIFI7 Micro ATX Motherboard for AMD Socket AM5 with AMD X870 Chipset, DDR5 Support, Wi-Fi 7, USB4, PCIe 5.0",https://compumarts.com,heuristic
2026-07-13T19:41:19.322740+00:00,compumarts.com,GIGABYTE B840M DS3H WIFI6 Micro ATX Motherboard AMD Socket AM5 DDR5 Wi-Fi 6,,https://compumarts.com/collections/new-arrivel-accessories-%F0%9F%8E%A7/products/gigabyte-b840m-ds3h-wifi6-micro-atx-motherboard-egypt,Available,840.0,EGP,GIGABYTE B840M DS3H WIFI6 Micro ATX Motherboard AMD Socket AM5 DDR5 Wi-Fi 6,https://compumarts.com,heuristic
2026-07-13T19:41:19.331647+00:00,compumarts.com,GIGABYTE B840M GAMING X WIFI6E Micro ATX Motherboard AMD Socket AM5 DDR5 Wi-Fi 6E,,https://compumarts.com/collections/new-arrivel-accessories-%F0%9F%8E%A7/products/gigabyte-b840m-gaming-x-wifi6e-micro-atx-motherboard-egypt,Available,840.0,EGP,GIGABYTE B840M GAMING X WIFI6E Micro ATX Motherboard AMD Socket AM5 DDR5 Wi-Fi 6E,https://compumarts.com,heuristic
2026-07-13T19:41:19.340488+00:00,compumarts.com,"GIGABYTE B760 DS3H GEN5 ATX Motherboard for LGA1700 Intel Processors with DDR5 Support, PCIe 5.0 x16, Dual M.2 PCIe 4.0 and USB 3.2 Gen 2x2",,https://compumarts.com/collections/new-arrivel-accessories-%F0%9F%8E%A7/products/gigabyte-b760-ds3h-gen5-motherboard-lga1700-ddr5-pcie5-egypt,Available,760.0,EGP,"GIGABYTE B760 DS3H GEN5 ATX Motherboard for LGA1700 Intel Processors with DDR5 Support, PCIe 5.0 x16, Dual M.2 PCIe 4.0 and USB 3.2 Gen 2x2",https://compumarts.com,heuristic
2026-07-13T19:41:19.352798+00:00,compumarts.com,GIGABYTE B840M A ELITE WIFI6E Micro ATX Motherboard AMD Socket AM5 DDR5 Wi-Fi 6E,,https://compumarts.com/collections/new-arrivel-accessories-%F0%9F%8E%A7/products/gigabyte-b840m-a-elite-wifi6e-micro-atx-motherboard-egypt,Available,840.0,EGP,GIGABYTE B840M A ELITE WIFI6E Micro ATX Motherboard AMD Socket AM5 DDR5 Wi-Fi 6E,https://compumarts.com,heuristic
2026-07-13T19:41:19.361683+00:00,compumarts.com,GIGABYTE H810M H Rev. 1.0 Micro ATX Motherboard LGA1851 DDR5 PCIe 4.0,,https://compumarts.com/collections/new-arrivel-accessories-%F0%9F%8E%A7/products/products-gigabyte-h810m-h-lga1851-ddr5-micro-atx-motherboard,Available,810.0,EGP,GIGABYTE H810M H Rev. 1.0 Micro ATX Motherboard LGA1851 DDR5 PCIe 4.0,https://compumarts.com,heuristic
2026-07-13T19:41:19.370547+00:00,compumarts.com,"GIGABYTE X870E AORUS XTREME AI TOP E-ATX AM5 Motherboard with AMD X870E, DDR5, PCIe 5.0, USB4, Wi-Fi 7, Dual 10GbE LAN",,https://compumarts.com/collections/new-arrivel-accessories-%F0%9F%8E%A7/products/products-gigabyte-x870e-aorus-xtreme-ai-top-am5-ddr5-pcie-5-motherboard-egypt,Available,870.0,EGP,"GIGABYTE X870E AORUS XTREME AI TOP  E-ATX AM5 Motherboard with AMD X870E, DDR5, PCIe 5.0, USB4, Wi-Fi 7, Dual 10GbE LAN",https://compumarts.com,heuristic
