timestamp_iso,site_name,product_name,sku,product_url,status,price_value,currency,raw_price_text,source_url,notes
2026-04-06T01:16:07.402961+00:00,shamystores.com,Buy Final Fantasy Xvi Used in Egypt | Shamy Stores,,https://shamystores.com/products/outlet-final-fantasy-xvi-used,Available,1750.0,EGP,"Sale priceFrom 1,750 EGP",https://shamystores.com,heuristic
2026-04-06T01:16:53.657406+00:00,shamystores.com,Buy Ac Adapter Dobe for Switch in Egypt | Shamy Stores,,https://shamystores.com/products/ac-adapter-dobe-for-switch-tns-5159,Out of Stock,450.0,EGP,Sale price450 EGP,https://shamystores.com/collections/all,heuristic
2026-04-06T01:17:39.583168+00:00,shamystores.com,Buy Controller Performance Thumb Grips in Egypt | Shamy Stores,,https://shamystores.com/products/controller-performance-thumb-grips-41014003056437,Available,175.0,EGP,Sale price175 EGP,https://shamystores.com/collections/accessories,heuristic
2026-04-06T01:17:39.613786+00:00,shamystores.com,Buy Onikuma K1b Gaming Headset in Egypt | Shamy Stores,,https://shamystores.com/products/onikuma-k1b-gaming-headset-41014003057239,Available,690.0,EGP,Sale price690 EGP,https://shamystores.com/collections/accessories,heuristic
2026-04-06T01:19:10.783444+00:00,shamystores.com,Buy Final Fantasy Vii Rebirth in Egypt | Shamy Stores,,https://shamystores.com/products/final-fantasy-vii-rebirth-used,Out of Stock,1900.0,EGP,"Sale price1,900 EGP",https://shamystores.com/collections/ps5-used-games?page=2,heuristic
2026-04-06T01:19:56.782373+00:00,shamystores.com,Delivery Only Sale price From Final Fantasy VII Remake Intergrade Used Square Enix Sold out Sold out Quick view,,https://shamystores.com/products/final-fantasy-vii-remake-intergrade-used-40015002045221,Out of Stock,600.0,EGP,Sale priceFrom 600 EGP,https://shamystores.com/collections/ps5-used-games?page=3,heuristic
2026-04-06T01:21:28.769424+00:00,shamystores.com,Buy Anker Lightning Cable for Apple in Egypt | Shamy Stores,,https://shamystores.com/products/anker-lightning-cable-for-apple-20041003057584,Out of Stock,290.0,EGP,Sale price290 EGP,https://shamystores.com/collections/all?page=2,heuristic
2026-04-06T01:21:28.780160+00:00,shamystores.com,Buy Anker Power Line Usb-c to Lightning 2.0 Cable 3ft (black) in Egypt | Shamy Stores,,https://shamystores.com/products/anker-powerline-iii-usb-c-to-lightning-2-0-cable-3ft-black,Out of Stock,390.0,EGP,Sale price390 EGP,https://shamystores.com/collections/all?page=2,heuristic
2026-04-06T01:21:28.804547+00:00,shamystores.com,Save 100 Sale price Regular price Anker PowerLine Select+ Lightning Cable Black (6ft) Anker Sold out Sold out Quick view,,https://shamystores.com/products/anker-powerline-select-lightning-cable-black-6ft,Out of Stock,290.0,EGP,Sale price290 EGP,https://shamystores.com/collections/all?page=2,heuristic
2026-04-06T01:21:28.809882+00:00,shamystores.com,Buy Anker Powerwave Magnetic 2-in-1 Stand + Anker Magnetic Phone Grip (maggo) 610 in Egypt | Shamy Stores,,https://shamystores.com/products/anker-powerwave-magnetic-2-in-1-stand-white,Out of Stock,1090.0,EGP,"Sale price1,090 EGP",https://shamystores.com/collections/all?page=2,heuristic
2026-04-06T01:23:00.949139+00:00,shamystores.com,YESIDO C226 Phone Cooler with Temperature Display – New,,https://shamystores.com/products/yesido-c226-phone-cooler,Available,690.0,EGP,Sale price690 EGP,https://shamystores.com/collections/all?page=90,heuristic
2026-04-06T01:23:00.954551+00:00,shamystores.com,YESIDO EK01 Gaming Headset – New,,https://shamystores.com/products/yesido-ek01-gaming-headset,Out of Stock,1040.0,EGP,"Sale price1,040 EGP",https://shamystores.com/collections/all?page=90,heuristic
2026-04-06T01:23:46.896699+00:00,shamystores.com,"(Universal Compatibility) Shamy Stores In stock, 10 units Add to cart Quick view",,https://shamystores.com/products/standard-power-cable,Available,155.0,EGP,Sale price155 EGP,https://shamystores.com/collections/accessories?page=2,heuristic
2026-04-06T01:23:46.993250+00:00,shamystores.com,Buy Redragon K552 Kumara Led Backlit Mechanical Gaming Keyboard in Egypt | Shamy Stores,,https://shamystores.com/products/redragon-k552-kumara-led-backlit-mechanical-gaming-keyboard,Available,1890.0,EGP,"Sale price1,890 EGP",https://shamystores.com/collections/accessories?page=2,heuristic
2026-04-06T01:23:47.015105+00:00,shamystores.com,Buy Dobe Protective Shell for Switch Pro Controller in Egypt | Shamy Stores,,https://shamystores.com/products/dobe-protective-shell-for-switch-pro-controller-41021003056365,Available,190.0,EGP,Sale price190 EGP,https://shamystores.com/collections/accessories?page=2,heuristic
2026-04-06T01:23:47.020471+00:00,shamystores.com,YESIDO C226 Phone Cooler with Temperature Display – New,,https://shamystores.com/products/yesido-c226-phone-cooler,Available,690.0,EGP,Sale price690 EGP,https://shamystores.com/collections/accessories?page=2,heuristic
2026-04-06T01:23:47.025917+00:00,shamystores.com,Spider-Man 2 Controller Carry Case – New (Universal Controllers),,https://shamystores.com/products/spiderman-controller-case,Available,490.0,EGP,Sale price490 EGP,https://shamystores.com/collections/accessories?page=2,heuristic
2026-04-06T01:24:32.928133+00:00,shamystores.com,JSAUX Battle Armor Protective Case – New (Switch 2),,https://shamystores.com/products/jsaux-battle-armor-case-switch-2,Available,890.0,EGP,Sale price890 EGP,https://shamystores.com/collections/accessories?page=3,heuristic
2026-04-06T01:24:32.965760+00:00,shamystores.com,ONIKUMA CW905 Gaming Mouse – New,,https://shamystores.com/products/onikuma-cw905-gaming-mouse,Available,790.0,EGP,Sale price790 EGP,https://shamystores.com/collections/accessories?page=3,heuristic
2026-04-06T01:24:32.971088+00:00,shamystores.com,ONIKUMA CW902 Gaming Mouse – New,,https://shamystores.com/products/onikuma-cw902-gaming-mouse,Available,590.0,EGP,Sale price590 EGP,https://shamystores.com/collections/accessories?page=3,heuristic
2026-04-06T01:24:33.013916+00:00,shamystores.com,Buy Dobe Stereo Headphone Small Ty-1802 in Egypt | Shamy Stores,,https://shamystores.com/products/dobe-stereo-headphone-small-ty180,Available,590.0,EGP,Sale price590 EGP,https://shamystores.com/collections/accessories?page=3,heuristic
2026-04-06T01:24:33.025779+00:00,shamystores.com,Charging CabM DOBE for Switch (TNS-5166),,https://shamystores.com/products/dobe-charging-cable-1-5m-for-switch-tns-5166,Available,290.0,EGP,Sale price290 EGP,https://shamystores.com/collections/accessories?page=3,heuristic
2026-04-06T01:24:33.031201+00:00,shamystores.com,Buy Dobe Silicon Protective Case for Switch 2 in Egypt | Shamy Stores,,https://shamystores.com/products/dobe-silicon-protective-case-for-switch-2-tns-3158,Available,390.0,EGP,Sale price390 EGP,https://shamystores.com/collections/accessories?page=3,heuristic
2026-04-06T01:24:33.041869+00:00,shamystores.com,Buy Crystal Case Dobe for Joy-con Switch Oled in Egypt | Shamy Stores,,https://shamystores.com/products/crystal-case-dobe-joy-con-switch-oled,Available,390.0,EGP,Sale price390 EGP,https://shamystores.com/collections/accessories?page=3,heuristic
2026-04-06T01:24:33.057937+00:00,shamystores.com,Buy Multifunctional Storage Stand Dobe All Switch in Egypt | Shamy Stores,,https://shamystores.com/products/multifunctional-storage-stand-dobe-all-switch-tns-19051b,Available,790.0,EGP,Sale price790 EGP,https://shamystores.com/collections/accessories?page=3,heuristic
2026-04-06T01:24:33.089887+00:00,shamystores.com,Buy Dobe Wall Mount Bundle for All Switch in Egypt | Shamy Stores,,https://shamystores.com/products/dobe-wall-mount-bundle-switch-tns-3113,Available,1190.0,EGP,"Sale price1,190 EGP",https://shamystores.com/collections/accessories?page=3,heuristic
2026-04-06T01:24:33.100648+00:00,shamystores.com,Buy Crystal Case Dobe for Switch 2 in Egypt | Shamy Stores,,https://shamystores.com/products/crystal-case-dobe-switch-2,Available,490.0,EGP,Sale price490 EGP,https://shamystores.com/collections/accessories?page=3,heuristic
2026-04-06T01:26:04.175475+00:00,shamystores.com,Buy Final Fantasy Xvi Used in Egypt | Shamy Stores,,https://shamystores.com/products/outlet-final-fantasy-xvi-used,Available,1750.0,EGP,"Sale priceFrom 1,750 EGP",https://shamystores.com/collections/ps5-used-games?page=1,heuristic
2026-04-06T01:27:36.221649+00:00,shamystores.com,Buy Ac Adapter Dobe for Switch in Egypt | Shamy Stores,,https://shamystores.com/products/ac-adapter-dobe-for-switch-tns-5159,Out of Stock,450.0,EGP,Sale price450 EGP,https://shamystores.com/collections/all?page=1,heuristic
2026-04-06T01:29:08.083527+00:00,shamystores.com,Buy Baseus Cloud Gel Protective Case for Airpods Pro in Egypt | Shamy Stores,,https://shamystores.com/products/baseus-cloud-gel-protective-case-for-airpods-pro,Available,240.0,EGP,Sale price240 EGP,https://shamystores.com/collections/all?page=5,heuristic
2026-04-06T01:29:08.088830+00:00,shamystores.com,Buy Baseus Glaze Gravity Car Mount in Egypt | Shamy Stores,,https://shamystores.com/products/baseus-glaze-gravity-car-mount,Out of Stock,350.0,EGP,Sale price350 EGP,https://shamystores.com/collections/all?page=5,heuristic
2026-04-06T01:31:25.552672+00:00,shamystores.com,Buy Controller Performance Thumb Grips in Egypt | Shamy Stores,,https://shamystores.com/products/controller-performance-thumb-grips-41014003056437,Available,175.0,EGP,Sale price175 EGP,https://shamystores.com/collections/accessories?page=1,heuristic
2026-04-06T01:31:25.583670+00:00,shamystores.com,Buy Onikuma K1b Gaming Headset in Egypt | Shamy Stores,,https://shamystores.com/products/onikuma-k1b-gaming-headset-41014003057239,Available,690.0,EGP,Sale price690 EGP,https://shamystores.com/collections/accessories?page=1,heuristic
2026-04-06T01:32:11.465849+00:00,shamystores.com,Buy Baseus Cloud Gel Protective Case for Airpods Pro in Egypt | Shamy Stores,,https://shamystores.com/products/baseus-cloud-gel-protective-case-for-airpods-pro,Available,240.0,EGP,Sale price240 EGP,https://shamystores.com/collections/accessories?page=4,heuristic
2026-04-06T01:32:11.508396+00:00,shamystores.com,Buy Dobe Stereo Headphone in Egypt | Shamy Stores,,https://shamystores.com/products/dobe-stereo-headphone-41010003056700,Out of Stock,290.0,EGP,Sale price290 EGP,https://shamystores.com/collections/accessories?page=4,heuristic
2026-04-06T01:32:57.103392+00:00,shamystores.com,Buy Controller Charging Stand in Egypt | Shamy Stores,,https://shamystores.com/products/controller-charging-stand-041014003055982,Out of Stock,120.0,EGP,Sale price120 EGP,https://shamystores.com/collections/accessories?page=5,heuristic
2026-04-06T01:32:57.174519+00:00,shamystores.com,Buy Redragon H120 Wired Gaming Headset in Egypt | Shamy Stores,,https://shamystores.com/products/redragon-h120-wired-gaming-headset-41010003057997,Out of Stock,390.0,EGP,Sale price390 EGP,https://shamystores.com/collections/accessories?page=5,heuristic
2026-04-06T01:32:57.179820+00:00,shamystores.com,Buy Redragon Nothosaur M606 Gaming Mouse in Egypt | Shamy Stores,,https://shamystores.com/products/redragon-nothosaur-m606-gaming-mouse-41010003057991,Out of Stock,550.0,EGP,Sale price550 EGP,https://shamystores.com/collections/accessories?page=5,heuristic
2026-04-06T01:32:57.215000+00:00,shamystores.com,Buy Logitech G203 Gaming Mouse in Egypt | Shamy Stores,,https://shamystores.com/products/logitech-g203-gaming-mouse-41010003058209,Out of Stock,499.0,EGP,Sale price499 EGP,https://shamystores.com/collections/accessories?page=5,heuristic
2026-04-06T01:32:57.220387+00:00,shamystores.com,Buy Onikuma K5 Headset in Egypt | Shamy Stores,,https://shamystores.com/products/onikuma-k5-headset-41014003057246,Out of Stock,690.0,EGP,Sale price690 EGP,https://shamystores.com/collections/accessories?page=5,heuristic
2026-04-06T01:50:15.129171+00:00,compumarts.com,Lexar NM790 4TB NVMe SSD PCIe Gen4x4 M.2 2280 with Heatsink 7400MB/s Read 6500MB/s Write,,https://compumarts.com/collections/new-arrivel-accessories-%F0%9F%8E%A7/products/lexar-nm790-4tb-nvme-gen4-ssd,Available,790.0,EGP,Lexar NM790 4TB NVMe SSD PCIe Gen4x4 M.2 2280 with Heatsink 7400MB/s Read 6500MB/s Write,https://compumarts.com,heuristic
2026-04-06T01:50:15.152203+00:00,compumarts.com,MSI PRO B860M-E LGA1851 DDR5 mATX Motherboard,,https://compumarts.com/collections/new-arrivel-accessories-%F0%9F%8E%A7/products/msi-pro-b860m-e-lga1851-ddr5-motherboard-egypt,Available,860.0,EGP,MSI PRO B860M-E LGA1851 DDR5 mATX Motherboard,https://compumarts.com,heuristic
2026-04-06T01:50:15.162743+00:00,compumarts.com,MSI B760M GAMING PLUS WIFI GEN5 LGA1700 DDR5 mATX Gaming Motherboard,,https://compumarts.com/collections/new-arrivel-accessories-%F0%9F%8E%A7/products/msi-b760m-gaming-plus-wifi-gen5-lga1700-ddr5-motherboard-egypt,Available,760.0,EGP,MSI B760M GAMING PLUS WIFI GEN5 LGA1700 DDR5 mATX Gaming Motherboard,https://compumarts.com,heuristic
2026-04-06T01:50:15.219384+00:00,compumarts.com,GIGABYTE B760M GAMING PLUS WIFI DDR4 LGA1700 mATX Gaming Motherboard,,https://compumarts.com/collections/new-arrivel-accessories-%F0%9F%8E%A7/products/gigabyte-b760m-gaming-plus-wifi-ddr4-lga1700-matx-gaming-motherboard,Available,760.0,EGP,GIGABYTE B760M GAMING PLUS WIFI DDR4 LGA1700 mATX Gaming Motherboard,https://compumarts.com,heuristic
2026-04-06T01:50:15.233862+00:00,compumarts.com,MSI MAG B850 TOMAHAWK MAX WIFI AM5 DDR5 ATX Gaming Motherboard,,https://compumarts.com/collections/new-arrivel-accessories-%F0%9F%8E%A7/products/msi-mag-b850-tomahawk-max-wifi-am5-ddr5-motherboard-egypt,Available,850.0,EGP,MSI MAG B850 TOMAHAWK MAX WIFI AM5 DDR5 ATX Gaming Motherboard,https://compumarts.com,heuristic
2026-04-06T01:50:15.244335+00:00,compumarts.com,MSI B850M GAMING PLUS WIFI AM5 DDR5 mATX Gaming Motherboard,,https://compumarts.com/collections/new-arrivel-accessories-%F0%9F%8E%A7/products/msi-b850m-gaming-plus-wifi-am5-ddr5-motherboard-egypt,Available,850.0,EGP,MSI B850M GAMING PLUS WIFI AM5 DDR5 mATX Gaming Motherboard,https://compumarts.com,heuristic
2026-04-06T01:50:15.271958+00:00,compumarts.com,MSI PRO B850M-P AM5 DDR5 mATX Gaming Motherboard,,https://compumarts.com/collections/new-arrivel-accessories-%F0%9F%8E%A7/products/msi-pro-b850m-p-am5-ddr5-gaming-motherboard-egypt,Available,850.0,EGP,MSI PRO B850M-P AM5 DDR5 mATX Gaming Motherboard,https://compumarts.com,heuristic
2026-04-06T01:50:15.428790+00:00,compumarts.com,Lexar NM790 4TB NVMe SSD PCIe Gen4x4 M.2 2280 with Heatsink 7400MB/s Read 6500MB/s Write,,https://compumarts.com/collections/new-arrivel-accessories-%F0%9F%8E%A7/products/lexar-nm790-4tb-nvme-gen4-ssd,Available,790.0,EGP,Lexar NM790 4TB NVMe SSD PCIe Gen4x4 M.2 2280 with Heatsink 7400MB/s Read 6500MB/s Write,https://compumarts.com,heuristic
2026-04-06T01:50:15.452161+00:00,compumarts.com,MSI PRO B860M-E LGA1851 DDR5 mATX Motherboard,,https://compumarts.com/collections/new-arrivel-accessories-%F0%9F%8E%A7/products/msi-pro-b860m-e-lga1851-ddr5-motherboard-egypt,Available,860.0,EGP,MSI PRO B860M-E LGA1851 DDR5 mATX Motherboard,https://compumarts.com,heuristic
2026-04-06T01:50:15.462810+00:00,compumarts.com,MSI B760M GAMING PLUS WIFI GEN5 LGA1700 DDR5 mATX Gaming Motherboard,,https://compumarts.com/collections/new-arrivel-accessories-%F0%9F%8E%A7/products/msi-b760m-gaming-plus-wifi-gen5-lga1700-ddr5-motherboard-egypt,Available,760.0,EGP,MSI B760M GAMING PLUS WIFI GEN5 LGA1700 DDR5 mATX Gaming Motherboard,https://compumarts.com,heuristic
2026-04-06T01:50:15.520187+00:00,compumarts.com,GIGABYTE B760M GAMING PLUS WIFI DDR4 LGA1700 mATX Gaming Motherboard,,https://compumarts.com/collections/new-arrivel-accessories-%F0%9F%8E%A7/products/gigabyte-b760m-gaming-plus-wifi-ddr4-lga1700-matx-gaming-motherboard,Available,760.0,EGP,GIGABYTE B760M GAMING PLUS WIFI DDR4 LGA1700 mATX Gaming Motherboard,https://compumarts.com,heuristic
2026-04-06T01:50:15.534795+00:00,compumarts.com,MSI MAG B850 TOMAHAWK MAX WIFI AM5 DDR5 ATX Gaming Motherboard,,https://compumarts.com/collections/new-arrivel-accessories-%F0%9F%8E%A7/products/msi-mag-b850-tomahawk-max-wifi-am5-ddr5-motherboard-egypt,Available,850.0,EGP,MSI MAG B850 TOMAHAWK MAX WIFI AM5 DDR5 ATX Gaming Motherboard,https://compumarts.com,heuristic
2026-04-06T01:50:15.545336+00:00,compumarts.com,MSI B850M GAMING PLUS WIFI AM5 DDR5 mATX Gaming Motherboard,,https://compumarts.com/collections/new-arrivel-accessories-%F0%9F%8E%A7/products/msi-b850m-gaming-plus-wifi-am5-ddr5-motherboard-egypt,Available,850.0,EGP,MSI B850M GAMING PLUS WIFI AM5 DDR5 mATX Gaming Motherboard,https://compumarts.com,heuristic
2026-04-06T01:50:15.572808+00:00,compumarts.com,MSI PRO B850M-P AM5 DDR5 mATX Gaming Motherboard,,https://compumarts.com/collections/new-arrivel-accessories-%F0%9F%8E%A7/products/msi-pro-b850m-p-am5-ddr5-gaming-motherboard-egypt,Available,850.0,EGP,MSI PRO B850M-P AM5 DDR5 mATX Gaming Motherboard,https://compumarts.com,heuristic
2026-04-06T01:51:47.870800+00:00,compumarts.com,Lexar NM790 4TB NVMe SSD PCIe Gen4x4 M.2 2280 with Heatsink 7400MB/s Read 6500MB/s Write,,https://compumarts.com/collections/new-arrivel-accessories-%F0%9F%8E%A7/products/lexar-nm790-4tb-nvme-gen4-ssd,Available,790.0,EGP,Lexar NM790 4TB NVMe SSD PCIe Gen4x4 M.2 2280 with Heatsink 7400MB/s Read 6500MB/s Write,https://compumarts.com/?swoof=1&product_cat=accessories,heuristic
2026-04-06T01:51:47.894166+00:00,compumarts.com,MSI PRO B860M-E LGA1851 DDR5 mATX Motherboard,,https://compumarts.com/collections/new-arrivel-accessories-%F0%9F%8E%A7/products/msi-pro-b860m-e-lga1851-ddr5-motherboard-egypt,Available,860.0,EGP,MSI PRO B860M-E LGA1851 DDR5 mATX Motherboard,https://compumarts.com/?swoof=1&product_cat=accessories,heuristic
2026-04-06T01:51:47.904809+00:00,compumarts.com,MSI B760M GAMING PLUS WIFI GEN5 LGA1700 DDR5 mATX Gaming Motherboard,,https://compumarts.com/collections/new-arrivel-accessories-%F0%9F%8E%A7/products/msi-b760m-gaming-plus-wifi-gen5-lga1700-ddr5-motherboard-egypt,Available,760.0,EGP,MSI B760M GAMING PLUS WIFI GEN5 LGA1700 DDR5 mATX Gaming Motherboard,https://compumarts.com/?swoof=1&product_cat=accessories,heuristic
2026-04-06T01:51:47.961945+00:00,compumarts.com,GIGABYTE B760M GAMING PLUS WIFI DDR4 LGA1700 mATX Gaming Motherboard,,https://compumarts.com/collections/new-arrivel-accessories-%F0%9F%8E%A7/products/gigabyte-b760m-gaming-plus-wifi-ddr4-lga1700-matx-gaming-motherboard,Available,760.0,EGP,GIGABYTE B760M GAMING PLUS WIFI DDR4 LGA1700 mATX Gaming Motherboard,https://compumarts.com/?swoof=1&product_cat=accessories,heuristic
2026-04-06T01:51:47.976538+00:00,compumarts.com,MSI MAG B850 TOMAHAWK MAX WIFI AM5 DDR5 ATX Gaming Motherboard,,https://compumarts.com/collections/new-arrivel-accessories-%F0%9F%8E%A7/products/msi-mag-b850-tomahawk-max-wifi-am5-ddr5-motherboard-egypt,Available,850.0,EGP,MSI MAG B850 TOMAHAWK MAX WIFI AM5 DDR5 ATX Gaming Motherboard,https://compumarts.com/?swoof=1&product_cat=accessories,heuristic
2026-04-06T01:51:47.987000+00:00,compumarts.com,MSI B850M GAMING PLUS WIFI AM5 DDR5 mATX Gaming Motherboard,,https://compumarts.com/collections/new-arrivel-accessories-%F0%9F%8E%A7/products/msi-b850m-gaming-plus-wifi-am5-ddr5-motherboard-egypt,Available,850.0,EGP,MSI B850M GAMING PLUS WIFI AM5 DDR5 mATX Gaming Motherboard,https://compumarts.com/?swoof=1&product_cat=accessories,heuristic
2026-04-06T01:51:48.166765+00:00,compumarts.com,Lexar NM790 4TB NVMe SSD PCIe Gen4x4 M.2 2280 with Heatsink 7400MB/s Read 6500MB/s Write,,https://compumarts.com/collections/new-arrivel-accessories-%F0%9F%8E%A7/products/lexar-nm790-4tb-nvme-gen4-ssd,Available,790.0,EGP,Lexar NM790 4TB NVMe SSD PCIe Gen4x4 M.2 2280 with Heatsink 7400MB/s Read 6500MB/s Write,https://compumarts.com/?swoof=1&product_cat=accessories,heuristic
2026-04-06T01:51:48.189906+00:00,compumarts.com,MSI PRO B860M-E LGA1851 DDR5 mATX Motherboard,,https://compumarts.com/collections/new-arrivel-accessories-%F0%9F%8E%A7/products/msi-pro-b860m-e-lga1851-ddr5-motherboard-egypt,Available,860.0,EGP,MSI PRO B860M-E LGA1851 DDR5 mATX Motherboard,https://compumarts.com/?swoof=1&product_cat=accessories,heuristic
2026-04-06T01:51:48.200407+00:00,compumarts.com,MSI B760M GAMING PLUS WIFI GEN5 LGA1700 DDR5 mATX Gaming Motherboard,,https://compumarts.com/collections/new-arrivel-accessories-%F0%9F%8E%A7/products/msi-b760m-gaming-plus-wifi-gen5-lga1700-ddr5-motherboard-egypt,Available,760.0,EGP,MSI B760M GAMING PLUS WIFI GEN5 LGA1700 DDR5 mATX Gaming Motherboard,https://compumarts.com/?swoof=1&product_cat=accessories,heuristic
2026-04-06T01:51:48.256921+00:00,compumarts.com,GIGABYTE B760M GAMING PLUS WIFI DDR4 LGA1700 mATX Gaming Motherboard,,https://compumarts.com/collections/new-arrivel-accessories-%F0%9F%8E%A7/products/gigabyte-b760m-gaming-plus-wifi-ddr4-lga1700-matx-gaming-motherboard,Available,760.0,EGP,GIGABYTE B760M GAMING PLUS WIFI DDR4 LGA1700 mATX Gaming Motherboard,https://compumarts.com/?swoof=1&product_cat=accessories,heuristic
2026-04-06T01:51:48.271240+00:00,compumarts.com,MSI MAG B850 TOMAHAWK MAX WIFI AM5 DDR5 ATX Gaming Motherboard,,https://compumarts.com/collections/new-arrivel-accessories-%F0%9F%8E%A7/products/msi-mag-b850-tomahawk-max-wifi-am5-ddr5-motherboard-egypt,Available,850.0,EGP,MSI MAG B850 TOMAHAWK MAX WIFI AM5 DDR5 ATX Gaming Motherboard,https://compumarts.com/?swoof=1&product_cat=accessories,heuristic
2026-04-06T01:51:48.281673+00:00,compumarts.com,MSI B850M GAMING PLUS WIFI AM5 DDR5 mATX Gaming Motherboard,,https://compumarts.com/collections/new-arrivel-accessories-%F0%9F%8E%A7/products/msi-b850m-gaming-plus-wifi-am5-ddr5-motherboard-egypt,Available,850.0,EGP,MSI B850M GAMING PLUS WIFI AM5 DDR5 mATX Gaming Motherboard,https://compumarts.com/?swoof=1&product_cat=accessories,heuristic
