timestamp_iso,site_name,product_name,sku,product_url,status,price_value,currency,raw_price_text,source_url,notes
2026-04-12T18:31:30.834658+00:00,shamystores.com,Buy Final Fantasy Xvi Used in Egypt | Shamy Stores,,https://shamystores.com/products/outlet-final-fantasy-xvi-used,Available,1750.0,EGP,"Sale priceFrom 1,750 EGP",https://shamystores.com,heuristic
2026-04-12T18:32:17.518411+00:00,shamystores.com,Buy Ac Adapter Dobe for Switch in Egypt | Shamy Stores,,https://shamystores.com/products/ac-adapter-dobe-for-switch-tns-5159,Out of Stock,450.0,EGP,Sale price450 EGP,https://shamystores.com/collections/all,heuristic
2026-04-12T18:33:03.472921+00:00,shamystores.com,Buy Controller Performance Thumb Grips in Egypt | Shamy Stores,,https://shamystores.com/products/controller-performance-thumb-grips-41014003056437,Available,175.0,EGP,Sale price175 EGP,https://shamystores.com/collections/accessories,heuristic
2026-04-12T18:33:03.504024+00:00,shamystores.com,Buy Onikuma K1b Gaming Headset in Egypt | Shamy Stores,,https://shamystores.com/products/onikuma-k1b-gaming-headset-41014003057239,Available,690.0,EGP,Sale price690 EGP,https://shamystores.com/collections/accessories,heuristic
2026-04-12T18:34:34.723337+00:00,shamystores.com,Buy Final Fantasy Vii Rebirth in Egypt | Shamy Stores,,https://shamystores.com/products/final-fantasy-vii-rebirth-used,Out of Stock,1900.0,EGP,"Sale price1,900 EGP",https://shamystores.com/collections/ps5-used-games?page=2,heuristic
2026-04-12T18:35:20.863935+00:00,shamystores.com,Delivery Only Sale price From Final Fantasy VII Remake Intergrade Used Square Enix Sold out Sold out Quick view,,https://shamystores.com/products/final-fantasy-vii-remake-intergrade-used-40015002045221,Out of Stock,600.0,EGP,Sale priceFrom 600 EGP,https://shamystores.com/collections/ps5-used-games?page=3,heuristic
2026-04-12T18:36:52.786292+00:00,shamystores.com,Buy Anker Lightning Cable for Apple in Egypt | Shamy Stores,,https://shamystores.com/products/anker-lightning-cable-for-apple-20041003057584,Out of Stock,290.0,EGP,Sale price290 EGP,https://shamystores.com/collections/all?page=2,heuristic
2026-04-12T18:36:52.797202+00:00,shamystores.com,Buy Anker Power Line Usb-c to Lightning 2.0 Cable 3ft (black) in Egypt | Shamy Stores,,https://shamystores.com/products/anker-powerline-iii-usb-c-to-lightning-2-0-cable-3ft-black,Out of Stock,390.0,EGP,Sale price390 EGP,https://shamystores.com/collections/all?page=2,heuristic
2026-04-12T18:36:52.822049+00:00,shamystores.com,Save 100 Sale price Regular price Anker PowerLine Select+ Lightning Cable Black (6ft) Anker Sold out Sold out Quick view,,https://shamystores.com/products/anker-powerline-select-lightning-cable-black-6ft,Out of Stock,290.0,EGP,Sale price290 EGP,https://shamystores.com/collections/all?page=2,heuristic
2026-04-12T18:36:52.827475+00:00,shamystores.com,Buy Anker Powerwave Magnetic 2-in-1 Stand + Anker Magnetic Phone Grip (maggo) 610 in Egypt | Shamy Stores,,https://shamystores.com/products/anker-powerwave-magnetic-2-in-1-stand-white,Out of Stock,1090.0,EGP,"Sale price1,090 EGP",https://shamystores.com/collections/all?page=2,heuristic
2026-04-12T18:38:25.415067+00:00,shamystores.com,YESIDO C226 Phone Cooler with Temperature Display – New,,https://shamystores.com/products/yesido-c226-phone-cooler,Available,690.0,EGP,Sale price690 EGP,https://shamystores.com/collections/all?page=90,heuristic
2026-04-12T18:38:25.420449+00:00,shamystores.com,YESIDO EK01 Gaming Headset – New,,https://shamystores.com/products/yesido-ek01-gaming-headset,Out of Stock,1040.0,EGP,"Sale price1,040 EGP",https://shamystores.com/collections/all?page=90,heuristic
2026-04-12T18:39:11.512857+00:00,shamystores.com,Buy Redragon K552 Kumara Led Backlit Mechanical Gaming Keyboard in Egypt | Shamy Stores,,https://shamystores.com/products/redragon-k552-kumara-led-backlit-mechanical-gaming-keyboard,Available,1890.0,EGP,"Sale price1,890 EGP",https://shamystores.com/collections/accessories?page=2,heuristic
2026-04-12T18:39:11.540268+00:00,shamystores.com,Buy Dobe Protective Shell for Switch Pro Controller in Egypt | Shamy Stores,,https://shamystores.com/products/dobe-protective-shell-for-switch-pro-controller-41021003056365,Available,190.0,EGP,Sale price190 EGP,https://shamystores.com/collections/accessories?page=2,heuristic
2026-04-12T18:39:11.545676+00:00,shamystores.com,YESIDO C226 Phone Cooler with Temperature Display – New,,https://shamystores.com/products/yesido-c226-phone-cooler,Available,690.0,EGP,Sale price690 EGP,https://shamystores.com/collections/accessories?page=2,heuristic
2026-04-12T18:39:11.551242+00:00,shamystores.com,Spider-Man 2 Controller Carry Case – New (Universal Controllers),,https://shamystores.com/products/spiderman-controller-case,Available,490.0,EGP,Sale price490 EGP,https://shamystores.com/collections/accessories?page=2,heuristic
2026-04-12T18:39:57.520246+00:00,shamystores.com,JSAUX Battle Armor Protective Case – New (Switch 2),,https://shamystores.com/products/jsaux-battle-armor-case-switch-2,Available,890.0,EGP,Sale price890 EGP,https://shamystores.com/collections/accessories?page=3,heuristic
2026-04-12T18:39:57.558586+00:00,shamystores.com,ONIKUMA CW905 Gaming Mouse – New,,https://shamystores.com/products/onikuma-cw905-gaming-mouse,Available,790.0,EGP,Sale price790 EGP,https://shamystores.com/collections/accessories?page=3,heuristic
2026-04-12T18:39:57.564009+00:00,shamystores.com,ONIKUMA CW902 Gaming Mouse – New,,https://shamystores.com/products/onikuma-cw902-gaming-mouse,Available,590.0,EGP,Sale price590 EGP,https://shamystores.com/collections/accessories?page=3,heuristic
2026-04-12T18:39:57.601965+00:00,shamystores.com,Buy Dobe Stereo Headphone Small Ty-1802 in Egypt | Shamy Stores,,https://shamystores.com/products/dobe-stereo-headphone-small-ty180,Available,590.0,EGP,Sale price590 EGP,https://shamystores.com/collections/accessories?page=3,heuristic
2026-04-12T18:39:57.613785+00:00,shamystores.com,Charging CabM DOBE for Switch (TNS-5166),,https://shamystores.com/products/dobe-charging-cable-1-5m-for-switch-tns-5166,Available,290.0,EGP,Sale price290 EGP,https://shamystores.com/collections/accessories?page=3,heuristic
2026-04-12T18:39:57.619136+00:00,shamystores.com,Buy Dobe Silicon Protective Case for Switch 2 in Egypt | Shamy Stores,,https://shamystores.com/products/dobe-silicon-protective-case-for-switch-2-tns-3158,Available,390.0,EGP,Sale price390 EGP,https://shamystores.com/collections/accessories?page=3,heuristic
2026-04-12T18:39:57.629801+00:00,shamystores.com,Buy Crystal Case Dobe for Joy-con Switch Oled in Egypt | Shamy Stores,,https://shamystores.com/products/crystal-case-dobe-joy-con-switch-oled,Available,390.0,EGP,Sale price390 EGP,https://shamystores.com/collections/accessories?page=3,heuristic
2026-04-12T18:39:57.645920+00:00,shamystores.com,Buy Multifunctional Storage Stand Dobe All Switch in Egypt | Shamy Stores,,https://shamystores.com/products/multifunctional-storage-stand-dobe-all-switch-tns-19051b,Available,790.0,EGP,Sale price790 EGP,https://shamystores.com/collections/accessories?page=3,heuristic
2026-04-12T18:39:57.678163+00:00,shamystores.com,Buy Dobe Wall Mount Bundle for All Switch in Egypt | Shamy Stores,,https://shamystores.com/products/dobe-wall-mount-bundle-switch-tns-3113,Available,1190.0,EGP,"Sale price1,190 EGP",https://shamystores.com/collections/accessories?page=3,heuristic
2026-04-12T18:41:29.112259+00:00,shamystores.com,Buy Final Fantasy Xvi Used in Egypt | Shamy Stores,,https://shamystores.com/products/outlet-final-fantasy-xvi-used,Available,1750.0,EGP,"Sale priceFrom 1,750 EGP",https://shamystores.com/collections/ps5-used-games?page=1,heuristic
2026-04-12T18:43:01.327010+00:00,shamystores.com,Buy Ac Adapter Dobe for Switch in Egypt | Shamy Stores,,https://shamystores.com/products/ac-adapter-dobe-for-switch-tns-5159,Out of Stock,450.0,EGP,Sale price450 EGP,https://shamystores.com/collections/all?page=1,heuristic
2026-04-12T18:44:33.581758+00:00,shamystores.com,Buy Baseus Cloud Gel Protective Case for Airpods Pro in Egypt | Shamy Stores,,https://shamystores.com/products/baseus-cloud-gel-protective-case-for-airpods-pro,Available,240.0,EGP,Sale price240 EGP,https://shamystores.com/collections/all?page=5,heuristic
2026-04-12T18:44:33.587179+00:00,shamystores.com,Buy Baseus Glaze Gravity Car Mount in Egypt | Shamy Stores,,https://shamystores.com/products/baseus-glaze-gravity-car-mount,Out of Stock,350.0,EGP,Sale price350 EGP,https://shamystores.com/collections/all?page=5,heuristic
2026-04-12T18:46:52.440808+00:00,shamystores.com,Buy Controller Performance Thumb Grips in Egypt | Shamy Stores,,https://shamystores.com/products/controller-performance-thumb-grips-41014003056437,Available,175.0,EGP,Sale price175 EGP,https://shamystores.com/collections/accessories?page=1,heuristic
2026-04-12T18:46:52.471435+00:00,shamystores.com,Buy Onikuma K1b Gaming Headset in Egypt | Shamy Stores,,https://shamystores.com/products/onikuma-k1b-gaming-headset-41014003057239,Available,690.0,EGP,Sale price690 EGP,https://shamystores.com/collections/accessories?page=1,heuristic
2026-04-12T18:47:38.616368+00:00,shamystores.com,Buy Crystal Case Dobe for Switch 2 in Egypt | Shamy Stores,,https://shamystores.com/products/crystal-case-dobe-switch-2,Available,490.0,EGP,Sale price490 EGP,https://shamystores.com/collections/accessories?page=4,heuristic
2026-04-12T18:47:38.713665+00:00,shamystores.com,Buy Baseus Cloud Gel Protective Case for Airpods Pro in Egypt | Shamy Stores,,https://shamystores.com/products/baseus-cloud-gel-protective-case-for-airpods-pro,Available,240.0,EGP,Sale price240 EGP,https://shamystores.com/collections/accessories?page=4,heuristic
2026-04-12T18:47:38.757040+00:00,shamystores.com,Buy Dobe Stereo Headphone in Egypt | Shamy Stores,,https://shamystores.com/products/dobe-stereo-headphone-41010003056700,Out of Stock,290.0,EGP,Sale price290 EGP,https://shamystores.com/collections/accessories?page=4,heuristic
2026-04-12T18:48:24.605072+00:00,shamystores.com,Buy Controller Charging Stand in Egypt | Shamy Stores,,https://shamystores.com/products/controller-charging-stand-041014003055982,Out of Stock,120.0,EGP,Sale price120 EGP,https://shamystores.com/collections/accessories?page=5,heuristic
2026-04-12T18:48:24.671415+00:00,shamystores.com,Buy Redragon H120 Wired Gaming Headset in Egypt | Shamy Stores,,https://shamystores.com/products/redragon-h120-wired-gaming-headset-41010003057997,Out of Stock,390.0,EGP,Sale price390 EGP,https://shamystores.com/collections/accessories?page=5,heuristic
2026-04-12T18:48:24.676811+00:00,shamystores.com,Buy Redragon Nothosaur M606 Gaming Mouse in Egypt | Shamy Stores,,https://shamystores.com/products/redragon-nothosaur-m606-gaming-mouse-41010003057991,Out of Stock,550.0,EGP,Sale price550 EGP,https://shamystores.com/collections/accessories?page=5,heuristic
2026-04-12T18:48:24.707318+00:00,shamystores.com,Buy Logitech G203 Gaming Mouse in Egypt | Shamy Stores,,https://shamystores.com/products/logitech-g203-gaming-mouse-41010003058209,Out of Stock,499.0,EGP,Sale price499 EGP,https://shamystores.com/collections/accessories?page=5,heuristic
2026-04-12T18:48:24.712837+00:00,shamystores.com,Buy Onikuma K5 Headset in Egypt | Shamy Stores,,https://shamystores.com/products/onikuma-k5-headset-41014003057246,Out of Stock,690.0,EGP,Sale price690 EGP,https://shamystores.com/collections/accessories?page=5,heuristic
2026-04-12T19:05:08.547190+00:00,compumarts.com,Redragon Sempiten G712 Gaming Controller Black & Red with Mobile Holder,,https://compumarts.com/collections/new-arrivel-accessories-%F0%9F%8E%A7/products/redragon-sempiten-g712-gaming-controller-mobile-holder-egypt,Available,712.0,EGP,Redragon Sempiten G712 Gaming Controller Black & Red with Mobile Holder,https://compumarts.com,heuristic
2026-04-12T19:05:08.555823+00:00,compumarts.com,"Redragon H260 Hylas RGB Wired Gaming Headset, 50mm Drivers, Stereo Sound, Noise Cancelling Mic, USB + Dual 3.5mm Jack, RGB Lighting",,https://compumarts.com/collections/new-arrivel-accessories-%F0%9F%8E%A7/products/redragon-h260-hylas-rgb-gaming-headset-egypt,Available,260.0,EGP,"Redragon H260 Hylas RGB Wired Gaming Headset, 50mm Drivers, Stereo Sound, Noise Cancelling Mic, USB + Dual 3.5mm Jack, RGB Lighting",https://compumarts.com,heuristic
2026-04-12T19:05:08.559927+00:00,compumarts.com,"Redragon Zeus H510-FB Wired Gaming Headset, 53mm Drivers, 2.0 Stereo, Detachable Mic, 3.5mm + USB, Over-Ear",,https://compumarts.com/collections/new-arrivel-accessories-%F0%9F%8E%A7/products/redragon-zeus-h510-fb-gaming-headset-egypt,Available,510.0,EGP,"Redragon Zeus H510-FB Wired Gaming Headset, 53mm Drivers, 2.0 Stereo, Detachable Mic, 3.5mm + USB, Over-Ear",https://compumarts.com,heuristic
2026-04-12T19:05:08.564020+00:00,compumarts.com,Redragon K530W-RGB PRO Wireless 60% Mechanical Keyboard White – Blue/Orange Switch,,https://compumarts.com/collections/new-arrivel-accessories-%F0%9F%8E%A7/products/redragon-k530w-rgb-pro-wireless-60-keyboard-white-egypt,Available,530.0,EGP,Redragon K530W-RGB PRO Wireless 60% Mechanical Keyboard White – Blue/Orange Switch,https://compumarts.com,heuristic
2026-04-12T19:05:08.574772+00:00,compumarts.com,Redragon SHOKER M655-KS Wireless Gaming Mouse 4000 DPI 7 Programmable Buttons 2.4GHz USB Optical Ergonomic Mouse Black,,https://compumarts.com/collections/new-arrivel-accessories-%F0%9F%8E%A7/products/mouse-redragon-wl-m655-ks,Available,655.0,EGP,Redragon SHOKER M655-KS Wireless Gaming Mouse 4000 DPI 7 Programmable Buttons 2.4GHz USB Optical Ergonomic Mouse Black,https://compumarts.com,heuristic
2026-04-12T19:05:08.585419+00:00,compumarts.com,Crucial T705 4TB PCIe Gen5 NVMe M.2 SSD with Heatsink CT4000T705SSD5 Up to 14100MB/s Extreme Speed Gaming & Creator Storage,,https://compumarts.com/collections/new-arrivel-accessories-%F0%9F%8E%A7/products/crucial-t705-4tb-gen5-nvme-ssd,Available,705.0,EGP,Crucial T705 4TB PCIe Gen5 NVMe M.2 SSD with Heatsink CT4000T705SSD5 Up to 14100MB/s Extreme Speed Gaming & Creator Storage,https://compumarts.com,heuristic
2026-04-12T19:05:08.596146+00:00,compumarts.com,Crucial T705 2TB PCIe Gen5 NVMe M.2 SSD with Heatsink CT2000T705SSD5 Up to 14500MB/s High Speed Gaming & Creator Storage,,https://compumarts.com/collections/new-arrivel-accessories-%F0%9F%8E%A7/products/crucial-t705-2tb-gen5-nvme-ssd,Available,705.0,EGP,Crucial T705 2TB PCIe Gen5 NVMe M.2 SSD with Heatsink CT2000T705SSD5 Up to 14500MB/s High Speed Gaming & Creator Storage,https://compumarts.com,heuristic
2026-04-12T19:05:08.606744+00:00,compumarts.com,"Meetion K200 Standard Chocolate Keyboard – Waterproof, Silent Keys, 104 Keys",,https://compumarts.com/collections/new-arrivel-accessories-%F0%9F%8E%A7/products/meetion-k200-usb-chocolate-keyboard-egypt,Available,200.0,EGP,"Meetion K200 Standard Chocolate Keyboard – Waterproof, Silent Keys, 104 Keys",https://compumarts.com,heuristic
2026-04-12T19:05:08.672415+00:00,compumarts.com,"ASUS Vivobook Go E1504FA-BQ085W Laptop – Ryzen 5 7520U, 8GB RAM, 512GB SSD, 15.6"" FHD, Radeon Graphics, Windows 11 – Cool Silver",,https://compumarts.com/collections/new-arrivel-accessories-%F0%9F%8E%A7/products/asus-vivobook-go-e1504fa-bq085w-ryzen5-7520u-8gb-512gb-egypt,Available,1504.0,EGP,"ASUS Vivobook Go E1504FA-BQ085W Laptop – Ryzen 5 7520U, 8GB RAM, 512GB SSD, 15.6"" FHD, Radeon Graphics, Windows 11 – Cool Silver",https://compumarts.com,heuristic
2026-04-12T19:05:08.693550+00:00,compumarts.com,"Lexar NM790 1TB SSD with Heatsink, PCIe Gen4 NVMe M.2 2280, Up to 7400MB/s Read",,https://compumarts.com/collections/new-arrivel-accessories-%F0%9F%8E%A7/products/lexar-nm790-1tb-heatsink-ssd,Available,790.0,EGP,"Lexar NM790 1TB SSD with Heatsink, PCIe Gen4 NVMe M.2 2280, Up to 7400MB/s Read",https://compumarts.com,heuristic
2026-04-12T19:05:08.848237+00:00,compumarts.com,Redragon Sempiten G712 Gaming Controller Black & Red with Mobile Holder,,https://compumarts.com/collections/new-arrivel-accessories-%F0%9F%8E%A7/products/redragon-sempiten-g712-gaming-controller-mobile-holder-egypt,Available,712.0,EGP,Redragon Sempiten G712 Gaming Controller Black & Red with Mobile Holder,https://compumarts.com,heuristic
2026-04-12T19:05:08.856770+00:00,compumarts.com,"Redragon H260 Hylas RGB Wired Gaming Headset, 50mm Drivers, Stereo Sound, Noise Cancelling Mic, USB + Dual 3.5mm Jack, RGB Lighting",,https://compumarts.com/collections/new-arrivel-accessories-%F0%9F%8E%A7/products/redragon-h260-hylas-rgb-gaming-headset-egypt,Available,260.0,EGP,"Redragon H260 Hylas RGB Wired Gaming Headset, 50mm Drivers, Stereo Sound, Noise Cancelling Mic, USB + Dual 3.5mm Jack, RGB Lighting",https://compumarts.com,heuristic
2026-04-12T19:05:08.860864+00:00,compumarts.com,"Redragon Zeus H510-FB Wired Gaming Headset, 53mm Drivers, 2.0 Stereo, Detachable Mic, 3.5mm + USB, Over-Ear",,https://compumarts.com/collections/new-arrivel-accessories-%F0%9F%8E%A7/products/redragon-zeus-h510-fb-gaming-headset-egypt,Available,510.0,EGP,"Redragon Zeus H510-FB Wired Gaming Headset, 53mm Drivers, 2.0 Stereo, Detachable Mic, 3.5mm + USB, Over-Ear",https://compumarts.com,heuristic
2026-04-12T19:05:08.864915+00:00,compumarts.com,Redragon K530W-RGB PRO Wireless 60% Mechanical Keyboard White – Blue/Orange Switch,,https://compumarts.com/collections/new-arrivel-accessories-%F0%9F%8E%A7/products/redragon-k530w-rgb-pro-wireless-60-keyboard-white-egypt,Available,530.0,EGP,Redragon K530W-RGB PRO Wireless 60% Mechanical Keyboard White – Blue/Orange Switch,https://compumarts.com,heuristic
2026-04-12T19:05:08.875620+00:00,compumarts.com,Redragon SHOKER M655-KS Wireless Gaming Mouse 4000 DPI 7 Programmable Buttons 2.4GHz USB Optical Ergonomic Mouse Black,,https://compumarts.com/collections/new-arrivel-accessories-%F0%9F%8E%A7/products/mouse-redragon-wl-m655-ks,Available,655.0,EGP,Redragon SHOKER M655-KS Wireless Gaming Mouse 4000 DPI 7 Programmable Buttons 2.4GHz USB Optical Ergonomic Mouse Black,https://compumarts.com,heuristic
2026-04-12T19:05:08.886241+00:00,compumarts.com,Crucial T705 4TB PCIe Gen5 NVMe M.2 SSD with Heatsink CT4000T705SSD5 Up to 14100MB/s Extreme Speed Gaming & Creator Storage,,https://compumarts.com/collections/new-arrivel-accessories-%F0%9F%8E%A7/products/crucial-t705-4tb-gen5-nvme-ssd,Available,705.0,EGP,Crucial T705 4TB PCIe Gen5 NVMe M.2 SSD with Heatsink CT4000T705SSD5 Up to 14100MB/s Extreme Speed Gaming & Creator Storage,https://compumarts.com,heuristic
2026-04-12T19:05:08.897044+00:00,compumarts.com,Crucial T705 2TB PCIe Gen5 NVMe M.2 SSD with Heatsink CT2000T705SSD5 Up to 14500MB/s High Speed Gaming & Creator Storage,,https://compumarts.com/collections/new-arrivel-accessories-%F0%9F%8E%A7/products/crucial-t705-2tb-gen5-nvme-ssd,Available,705.0,EGP,Crucial T705 2TB PCIe Gen5 NVMe M.2 SSD with Heatsink CT2000T705SSD5 Up to 14500MB/s High Speed Gaming & Creator Storage,https://compumarts.com,heuristic
2026-04-12T19:05:08.907600+00:00,compumarts.com,"Meetion K200 Standard Chocolate Keyboard – Waterproof, Silent Keys, 104 Keys",,https://compumarts.com/collections/new-arrivel-accessories-%F0%9F%8E%A7/products/meetion-k200-usb-chocolate-keyboard-egypt,Available,200.0,EGP,"Meetion K200 Standard Chocolate Keyboard – Waterproof, Silent Keys, 104 Keys",https://compumarts.com,heuristic
2026-04-12T19:05:08.978165+00:00,compumarts.com,"ASUS Vivobook Go E1504FA-BQ085W Laptop – Ryzen 5 7520U, 8GB RAM, 512GB SSD, 15.6"" FHD, Radeon Graphics, Windows 11 – Cool Silver",,https://compumarts.com/collections/new-arrivel-accessories-%F0%9F%8E%A7/products/asus-vivobook-go-e1504fa-bq085w-ryzen5-7520u-8gb-512gb-egypt,Available,1504.0,EGP,"ASUS Vivobook Go E1504FA-BQ085W Laptop – Ryzen 5 7520U, 8GB RAM, 512GB SSD, 15.6"" FHD, Radeon Graphics, Windows 11 – Cool Silver",https://compumarts.com,heuristic
2026-04-12T19:05:08.999270+00:00,compumarts.com,"Lexar NM790 1TB SSD with Heatsink, PCIe Gen4 NVMe M.2 2280, Up to 7400MB/s Read",,https://compumarts.com/collections/new-arrivel-accessories-%F0%9F%8E%A7/products/lexar-nm790-1tb-heatsink-ssd,Available,790.0,EGP,"Lexar NM790 1TB SSD with Heatsink, PCIe Gen4 NVMe M.2 2280, Up to 7400MB/s Read",https://compumarts.com,heuristic
2026-04-12T19:06:40.390326+00:00,compumarts.com,Redragon Sempiten G712 Gaming Controller Black & Red with Mobile Holder,,https://compumarts.com/collections/new-arrivel-accessories-%F0%9F%8E%A7/products/redragon-sempiten-g712-gaming-controller-mobile-holder-egypt,Available,712.0,EGP,Redragon Sempiten G712 Gaming Controller Black & Red with Mobile Holder,https://compumarts.com/?swoof=1&product_cat=accessories,heuristic
2026-04-12T19:06:40.398857+00:00,compumarts.com,"Redragon H260 Hylas RGB Wired Gaming Headset, 50mm Drivers, Stereo Sound, Noise Cancelling Mic, USB + Dual 3.5mm Jack, RGB Lighting",,https://compumarts.com/collections/new-arrivel-accessories-%F0%9F%8E%A7/products/redragon-h260-hylas-rgb-gaming-headset-egypt,Available,260.0,EGP,"Redragon H260 Hylas RGB Wired Gaming Headset, 50mm Drivers, Stereo Sound, Noise Cancelling Mic, USB + Dual 3.5mm Jack, RGB Lighting",https://compumarts.com/?swoof=1&product_cat=accessories,heuristic
2026-04-12T19:06:40.402869+00:00,compumarts.com,"Redragon Zeus H510-FB Wired Gaming Headset, 53mm Drivers, 2.0 Stereo, Detachable Mic, 3.5mm + USB, Over-Ear",,https://compumarts.com/collections/new-arrivel-accessories-%F0%9F%8E%A7/products/redragon-zeus-h510-fb-gaming-headset-egypt,Available,510.0,EGP,"Redragon Zeus H510-FB Wired Gaming Headset, 53mm Drivers, 2.0 Stereo, Detachable Mic, 3.5mm + USB, Over-Ear",https://compumarts.com/?swoof=1&product_cat=accessories,heuristic
2026-04-12T19:06:40.406884+00:00,compumarts.com,Redragon K530W-RGB PRO Wireless 60% Mechanical Keyboard White – Blue/Orange Switch,,https://compumarts.com/collections/new-arrivel-accessories-%F0%9F%8E%A7/products/redragon-k530w-rgb-pro-wireless-60-keyboard-white-egypt,Available,530.0,EGP,Redragon K530W-RGB PRO Wireless 60% Mechanical Keyboard White – Blue/Orange Switch,https://compumarts.com/?swoof=1&product_cat=accessories,heuristic
2026-04-12T19:06:40.417514+00:00,compumarts.com,Redragon SHOKER M655-KS Wireless Gaming Mouse 4000 DPI 7 Programmable Buttons 2.4GHz USB Optical Ergonomic Mouse Black,,https://compumarts.com/collections/new-arrivel-accessories-%F0%9F%8E%A7/products/mouse-redragon-wl-m655-ks,Available,655.0,EGP,Redragon SHOKER M655-KS Wireless Gaming Mouse 4000 DPI 7 Programmable Buttons 2.4GHz USB Optical Ergonomic Mouse Black,https://compumarts.com/?swoof=1&product_cat=accessories,heuristic
2026-04-12T19:06:40.428125+00:00,compumarts.com,Crucial T705 4TB PCIe Gen5 NVMe M.2 SSD with Heatsink CT4000T705SSD5 Up to 14100MB/s Extreme Speed Gaming & Creator Storage,,https://compumarts.com/collections/new-arrivel-accessories-%F0%9F%8E%A7/products/crucial-t705-4tb-gen5-nvme-ssd,Available,705.0,EGP,Crucial T705 4TB PCIe Gen5 NVMe M.2 SSD with Heatsink CT4000T705SSD5 Up to 14100MB/s Extreme Speed Gaming & Creator Storage,https://compumarts.com/?swoof=1&product_cat=accessories,heuristic
2026-04-12T19:06:40.438704+00:00,compumarts.com,Crucial T705 2TB PCIe Gen5 NVMe M.2 SSD with Heatsink CT2000T705SSD5 Up to 14500MB/s High Speed Gaming & Creator Storage,,https://compumarts.com/collections/new-arrivel-accessories-%F0%9F%8E%A7/products/crucial-t705-2tb-gen5-nvme-ssd,Available,705.0,EGP,Crucial T705 2TB PCIe Gen5 NVMe M.2 SSD with Heatsink CT2000T705SSD5 Up to 14500MB/s High Speed Gaming & Creator Storage,https://compumarts.com/?swoof=1&product_cat=accessories,heuristic
2026-04-12T19:06:40.449310+00:00,compumarts.com,"Meetion K200 Standard Chocolate Keyboard – Waterproof, Silent Keys, 104 Keys",,https://compumarts.com/collections/new-arrivel-accessories-%F0%9F%8E%A7/products/meetion-k200-usb-chocolate-keyboard-egypt,Available,200.0,EGP,"Meetion K200 Standard Chocolate Keyboard – Waterproof, Silent Keys, 104 Keys",https://compumarts.com/?swoof=1&product_cat=accessories,heuristic
2026-04-12T19:06:40.514444+00:00,compumarts.com,"ASUS Vivobook Go E1504FA-BQ085W Laptop – Ryzen 5 7520U, 8GB RAM, 512GB SSD, 15.6"" FHD, Radeon Graphics, Windows 11 – Cool Silver",,https://compumarts.com/collections/new-arrivel-accessories-%F0%9F%8E%A7/products/asus-vivobook-go-e1504fa-bq085w-ryzen5-7520u-8gb-512gb-egypt,Available,1504.0,EGP,"ASUS Vivobook Go E1504FA-BQ085W Laptop – Ryzen 5 7520U, 8GB RAM, 512GB SSD, 15.6"" FHD, Radeon Graphics, Windows 11 – Cool Silver",https://compumarts.com/?swoof=1&product_cat=accessories,heuristic
2026-04-12T19:06:40.535317+00:00,compumarts.com,"Lexar NM790 1TB SSD with Heatsink, PCIe Gen4 NVMe M.2 2280, Up to 7400MB/s Read",,https://compumarts.com/collections/new-arrivel-accessories-%F0%9F%8E%A7/products/lexar-nm790-1tb-heatsink-ssd,Available,790.0,EGP,"Lexar NM790 1TB SSD with Heatsink, PCIe Gen4 NVMe M.2 2280, Up to 7400MB/s Read",https://compumarts.com/?swoof=1&product_cat=accessories,heuristic
2026-04-12T19:06:40.688065+00:00,compumarts.com,Redragon Sempiten G712 Gaming Controller Black & Red with Mobile Holder,,https://compumarts.com/collections/new-arrivel-accessories-%F0%9F%8E%A7/products/redragon-sempiten-g712-gaming-controller-mobile-holder-egypt,Available,712.0,EGP,Redragon Sempiten G712 Gaming Controller Black & Red with Mobile Holder,https://compumarts.com/?swoof=1&product_cat=accessories,heuristic
2026-04-12T19:06:40.696478+00:00,compumarts.com,"Redragon H260 Hylas RGB Wired Gaming Headset, 50mm Drivers, Stereo Sound, Noise Cancelling Mic, USB + Dual 3.5mm Jack, RGB Lighting",,https://compumarts.com/collections/new-arrivel-accessories-%F0%9F%8E%A7/products/redragon-h260-hylas-rgb-gaming-headset-egypt,Available,260.0,EGP,"Redragon H260 Hylas RGB Wired Gaming Headset, 50mm Drivers, Stereo Sound, Noise Cancelling Mic, USB + Dual 3.5mm Jack, RGB Lighting",https://compumarts.com/?swoof=1&product_cat=accessories,heuristic
