timestamp_iso,site_name,product_name,sku,product_url,status,price_value,currency,raw_price_text,source_url,notes
2026-04-12T19:06:40.700421+00:00,compumarts.com,"Redragon Zeus H510-FB Wired Gaming Headset, 53mm Drivers, 2.0 Stereo, Detachable Mic, 3.5mm + USB, Over-Ear",,https://compumarts.com/collections/new-arrivel-accessories-%F0%9F%8E%A7/products/redragon-zeus-h510-fb-gaming-headset-egypt,Available,510.0,EGP,"Redragon Zeus H510-FB Wired Gaming Headset, 53mm Drivers, 2.0 Stereo, Detachable Mic, 3.5mm + USB, Over-Ear",https://compumarts.com/?swoof=1&product_cat=accessories,heuristic
2026-04-12T19:06:40.704372+00:00,compumarts.com,Redragon K530W-RGB PRO Wireless 60% Mechanical Keyboard White – Blue/Orange Switch,,https://compumarts.com/collections/new-arrivel-accessories-%F0%9F%8E%A7/products/redragon-k530w-rgb-pro-wireless-60-keyboard-white-egypt,Available,530.0,EGP,Redragon K530W-RGB PRO Wireless 60% Mechanical Keyboard White – Blue/Orange Switch,https://compumarts.com/?swoof=1&product_cat=accessories,heuristic
2026-04-12T19:06:40.714946+00:00,compumarts.com,Redragon SHOKER M655-KS Wireless Gaming Mouse 4000 DPI 7 Programmable Buttons 2.4GHz USB Optical Ergonomic Mouse Black,,https://compumarts.com/collections/new-arrivel-accessories-%F0%9F%8E%A7/products/mouse-redragon-wl-m655-ks,Available,655.0,EGP,Redragon SHOKER M655-KS Wireless Gaming Mouse 4000 DPI 7 Programmable Buttons 2.4GHz USB Optical Ergonomic Mouse Black,https://compumarts.com/?swoof=1&product_cat=accessories,heuristic
2026-04-12T19:06:40.725416+00:00,compumarts.com,Crucial T705 4TB PCIe Gen5 NVMe M.2 SSD with Heatsink CT4000T705SSD5 Up to 14100MB/s Extreme Speed Gaming & Creator Storage,,https://compumarts.com/collections/new-arrivel-accessories-%F0%9F%8E%A7/products/crucial-t705-4tb-gen5-nvme-ssd,Available,705.0,EGP,Crucial T705 4TB PCIe Gen5 NVMe M.2 SSD with Heatsink CT4000T705SSD5 Up to 14100MB/s Extreme Speed Gaming & Creator Storage,https://compumarts.com/?swoof=1&product_cat=accessories,heuristic
2026-04-12T19:06:40.735904+00:00,compumarts.com,Crucial T705 2TB PCIe Gen5 NVMe M.2 SSD with Heatsink CT2000T705SSD5 Up to 14500MB/s High Speed Gaming & Creator Storage,,https://compumarts.com/collections/new-arrivel-accessories-%F0%9F%8E%A7/products/crucial-t705-2tb-gen5-nvme-ssd,Available,705.0,EGP,Crucial T705 2TB PCIe Gen5 NVMe M.2 SSD with Heatsink CT2000T705SSD5 Up to 14500MB/s High Speed Gaming & Creator Storage,https://compumarts.com/?swoof=1&product_cat=accessories,heuristic
2026-04-12T19:06:40.746311+00:00,compumarts.com,"Meetion K200 Standard Chocolate Keyboard – Waterproof, Silent Keys, 104 Keys",,https://compumarts.com/collections/new-arrivel-accessories-%F0%9F%8E%A7/products/meetion-k200-usb-chocolate-keyboard-egypt,Available,200.0,EGP,"Meetion K200 Standard Chocolate Keyboard – Waterproof, Silent Keys, 104 Keys",https://compumarts.com/?swoof=1&product_cat=accessories,heuristic
2026-04-12T19:06:40.810733+00:00,compumarts.com,"ASUS Vivobook Go E1504FA-BQ085W Laptop – Ryzen 5 7520U, 8GB RAM, 512GB SSD, 15.6"" FHD, Radeon Graphics, Windows 11 – Cool Silver",,https://compumarts.com/collections/new-arrivel-accessories-%F0%9F%8E%A7/products/asus-vivobook-go-e1504fa-bq085w-ryzen5-7520u-8gb-512gb-egypt,Available,1504.0,EGP,"ASUS Vivobook Go E1504FA-BQ085W Laptop – Ryzen 5 7520U, 8GB RAM, 512GB SSD, 15.6"" FHD, Radeon Graphics, Windows 11 – Cool Silver",https://compumarts.com/?swoof=1&product_cat=accessories,heuristic
2026-04-12T19:06:40.831612+00:00,compumarts.com,"Lexar NM790 1TB SSD with Heatsink, PCIe Gen4 NVMe M.2 2280, Up to 7400MB/s Read",,https://compumarts.com/collections/new-arrivel-accessories-%F0%9F%8E%A7/products/lexar-nm790-1tb-heatsink-ssd,Available,790.0,EGP,"Lexar NM790 1TB SSD with Heatsink, PCIe Gen4 NVMe M.2 2280, Up to 7400MB/s Read",https://compumarts.com/?swoof=1&product_cat=accessories,heuristic
