timestamp_iso,site_name,product_name,sku,product_url,status,price_value,currency,raw_price_text,source_url,notes
2026-06-13T19:04:48.986780+00:00,shamystores.com,Buy Final Fantasy Xvi Used in Egypt | Shamy Stores,,https://shamystores.com/products/outlet-final-fantasy-xvi-used,Available,1750.0,EGP,"Sale priceFrom 1,750 EGP",https://shamystores.com,heuristic
2026-06-13T19:05:34.863513+00:00,shamystores.com,Buy Ac Adapter Dobe for Switch in Egypt | Shamy Stores,,https://shamystores.com/products/ac-adapter-dobe-for-switch-tns-5159,Out of Stock,450.0,EGP,Sale price450 EGP,https://shamystores.com/collections/all,heuristic
2026-06-13T19:05:34.925924+00:00,shamystores.com,Save 100 Sale price Regular price Anker PowerLine Select+ Lightning Cable Black (6ft) Anker Sold out Sold out Quick view,,https://shamystores.com/products/anker-powerline-select-lightning-cable-black-6ft,Out of Stock,290.0,EGP,Sale price290 EGP,https://shamystores.com/collections/all,heuristic
2026-06-13T19:06:21.003965+00:00,shamystores.com,Buy Controller Performance Thumb Grips in Egypt | Shamy Stores,,https://shamystores.com/products/controller-performance-thumb-grips-41014003056437,Available,175.0,EGP,Sale price175 EGP,https://shamystores.com/collections/accessories,heuristic
2026-06-13T19:06:21.030472+00:00,shamystores.com,Buy Onikuma K1b Gaming Headset in Egypt | Shamy Stores,,https://shamystores.com/products/onikuma-k1b-gaming-headset-41014003057239,Available,690.0,EGP,Sale price690 EGP,https://shamystores.com/collections/accessories,heuristic
2026-06-13T19:08:37.947446+00:00,shamystores.com,Buy Final Fantasy Vii Rebirth in Egypt | Shamy Stores,,https://shamystores.com/products/final-fantasy-vii-rebirth-used,Out of Stock,1900.0,EGP,"Sale price1,900 EGP",https://shamystores.com/collections/ps5-used-games?page=3,heuristic
2026-06-13T19:09:23.466329+00:00,shamystores.com,Delivery Only Sale price From Final Fantasy VII Remake Intergrade Used Square Enix Sold out Sold out Quick view,,https://shamystores.com/products/final-fantasy-vii-remake-intergrade-used-40015002045221,Out of Stock,600.0,EGP,Sale priceFrom 600 EGP,https://shamystores.com/collections/ps5-used-games?page=4,heuristic
2026-06-13T19:10:55.388632+00:00,shamystores.com,Buy Baseus Cloud Gel Protective Case for Airpods Pro in Egypt | Shamy Stores,,https://shamystores.com/products/baseus-cloud-gel-protective-case-for-airpods-pro,Available,240.0,EGP,Sale price240 EGP,https://shamystores.com/collections/all?page=3,heuristic
2026-06-13T19:12:27.212945+00:00,shamystores.com,Spider-Man 2 Controller Carry Case – New (Universal Controllers),,https://shamystores.com/products/spiderman-controller-case,Available,490.0,EGP,Sale price490 EGP,https://shamystores.com/collections/accessories?page=2,heuristic
2026-06-13T19:12:27.216974+00:00,shamystores.com,JSAUX Battle Armor Protective Case – New (Switch 2),,https://shamystores.com/products/jsaux-battle-armor-case-switch-2,Available,890.0,EGP,Sale price890 EGP,https://shamystores.com/collections/accessories?page=2,heuristic
2026-06-13T19:12:27.269563+00:00,shamystores.com,Buy Dobe Protective Shell for Switch Pro Controller in Egypt | Shamy Stores,,https://shamystores.com/products/dobe-protective-shell-for-switch-pro-controller-41021003056365,Available,190.0,EGP,Sale price190 EGP,https://shamystores.com/collections/accessories?page=2,heuristic
2026-06-13T19:12:27.273452+00:00,shamystores.com,Controller Cases & Protection Collection,,https://shamystores.com/products/controller-cases,Available,690.0,EGP,Sale price690 EGP,https://shamystores.com/collections/accessories?page=2,heuristic
2026-06-13T19:12:27.277331+00:00,shamystores.com,YESIDO C226 Phone Cooler with Temperature Display – New,,https://shamystores.com/products/yesido-c226-phone-cooler,Available,690.0,EGP,Sale price690 EGP,https://shamystores.com/collections/accessories?page=2,heuristic
2026-06-13T19:13:12.636299+00:00,shamystores.com,YESIDO EK01 Gaming Headset – New,,https://shamystores.com/products/yesido-ek01-gaming-headset,Available,1190.0,EGP,"Sale price1,190 EGP",https://shamystores.com/collections/accessories?page=3,heuristic
2026-06-13T19:13:12.650467+00:00,shamystores.com,ONIKUMA CW905 Gaming Mouse – New,,https://shamystores.com/products/onikuma-cw905-gaming-mouse,Available,790.0,EGP,Sale price790 EGP,https://shamystores.com/collections/accessories?page=3,heuristic
2026-06-13T19:13:12.654356+00:00,shamystores.com,ONIKUMA CW902 Gaming Mouse – New,,https://shamystores.com/products/onikuma-cw902-gaming-mouse,Available,590.0,EGP,Sale price590 EGP,https://shamystores.com/collections/accessories?page=3,heuristic
2026-06-13T19:13:12.669923+00:00,shamystores.com,Buy Dobe Stereo Headphone Small Ty-1802 in Egypt | Shamy Stores,,https://shamystores.com/products/dobe-stereo-headphone-small-ty180,Available,590.0,EGP,Sale price590 EGP,https://shamystores.com/collections/accessories?page=3,heuristic
2026-06-13T19:13:12.674646+00:00,shamystores.com,Charging CabM DOBE for Switch (TNS-5166),,https://shamystores.com/products/dobe-charging-cable-1-5m-for-switch-tns-5166,Available,290.0,EGP,Sale price290 EGP,https://shamystores.com/collections/accessories?page=3,heuristic
2026-06-13T19:13:12.678528+00:00,shamystores.com,Buy Dobe Silicon Protective Case for Switch 2 in Egypt | Shamy Stores,,https://shamystores.com/products/dobe-silicon-protective-case-for-switch-2-tns-3158,Available,490.0,EGP,Sale price490 EGP,https://shamystores.com/collections/accessories?page=3,heuristic
2026-06-13T19:13:12.686283+00:00,shamystores.com,Buy Crystal Case Dobe for Joy-con Switch Oled in Egypt | Shamy Stores,,https://shamystores.com/products/crystal-case-dobe-joy-con-switch-oled,Available,390.0,EGP,Sale price390 EGP,https://shamystores.com/collections/accessories?page=3,heuristic
2026-06-13T19:13:12.697906+00:00,shamystores.com,Buy Multifunctional Storage Stand Dobe All Switch in Egypt | Shamy Stores,,https://shamystores.com/products/multifunctional-storage-stand-dobe-all-switch-tns-19051b,Available,790.0,EGP,Sale price790 EGP,https://shamystores.com/collections/accessories?page=3,heuristic
2026-06-13T19:13:12.717403+00:00,shamystores.com,Buy Dobe Wall Mount Bundle for All Switch in Egypt | Shamy Stores,,https://shamystores.com/products/dobe-wall-mount-bundle-switch-tns-3113,Available,1190.0,EGP,"Sale price1,190 EGP",https://shamystores.com/collections/accessories?page=3,heuristic
2026-06-13T19:13:12.721283+00:00,shamystores.com,Buy Crystal Case Dobe for Switch 2 in Egypt | Shamy Stores,,https://shamystores.com/products/crystal-case-dobe-switch-2,Available,550.0,EGP,Sale price550 EGP,https://shamystores.com/collections/accessories?page=3,heuristic
2026-06-13T19:13:57.993712+00:00,shamystores.com,Buy Hp S1000 Plus Wireless Mouse in Egypt | Shamy Stores,,https://shamystores.com/products/hp-s1000-plus-wireless-mouse,Out of Stock,250.0,EGP,Sale price250 EGP,https://shamystores.com/collections/accessories?page=7,heuristic
2026-06-13T19:13:57.995910+00:00,shamystores.com,Save 100 Sale price Regular price Redragon K506 Centaur 7-Color Gaming Keyboard Redragon Sold out Sold out Quick view,,https://shamystores.com/products/redragon-k506-centaur-7-color-gaming-keyboard,Out of Stock,690.0,EGP,Sale price690 EGP,https://shamystores.com/collections/accessories?page=7,heuristic
2026-06-13T19:13:58.025637+00:00,shamystores.com,Buy Redragon Kumara K552 Keyboard in Egypt | Shamy Stores,,https://shamystores.com/products/redragon-kumara-k552-keyboard-41010003057578,Out of Stock,1790.0,EGP,"Sale price1,790 EGP",https://shamystores.com/collections/accessories?page=7,heuristic
2026-06-13T19:13:58.027658+00:00,shamystores.com,Special Bundle Sale price Redragon M601-BA Gaming Mouse and Mouse Pad Kit Redragon Sold out Sold out Quick view,,https://shamystores.com/products/redragon-m601-ba-gaming-mouse-and-pad-kit-41010003058001,Out of Stock,450.0,EGP,Sale price450 EGP,https://shamystores.com/collections/accessories?page=7,heuristic
2026-06-13T19:13:58.031573+00:00,shamystores.com,Buy Redragon M705 Pegasus Gaming Mouse Pegasus in Egypt | Shamy Stores,,https://shamystores.com/products/redragon-m705-pegasus-gaming-mouse-41010003057606,Out of Stock,890.0,EGP,Sale price890 EGP,https://shamystores.com/collections/accessories?page=7,heuristic
2026-06-13T19:14:43.450442+00:00,shamystores.com,Buy Final Fantasy Xvi Used in Egypt | Shamy Stores,,https://shamystores.com/products/outlet-final-fantasy-xvi-used,Available,1750.0,EGP,"Sale priceFrom 1,750 EGP",https://shamystores.com/collections/ps5-used-games?page=1,heuristic
2026-06-13T19:15:28.825339+00:00,shamystores.com,Buy Ac Adapter Dobe for Switch in Egypt | Shamy Stores,,https://shamystores.com/products/ac-adapter-dobe-for-switch-tns-5159,Out of Stock,450.0,EGP,Sale price450 EGP,https://shamystores.com/collections/all?page=1,heuristic
2026-06-13T19:15:28.888145+00:00,shamystores.com,Save 100 Sale price Regular price Anker PowerLine Select+ Lightning Cable Black (6ft) Anker Sold out Sold out Quick view,,https://shamystores.com/products/anker-powerline-select-lightning-cable-black-6ft,Out of Stock,290.0,EGP,Sale price290 EGP,https://shamystores.com/collections/all?page=1,heuristic
2026-06-13T19:17:00.190596+00:00,shamystores.com,Buy Cable Hdmi Normal 5m in Egypt | Shamy Stores,,https://shamystores.com/products/cable-hdmi-normal-5m-4102060,Out of Stock,120.0,EGP,Sale price120 EGP,https://shamystores.com/collections/all?page=5,heuristic
2026-06-13T19:17:45.817104+00:00,shamystores.com,YESIDO C226 Phone Cooler with Temperature Display – New,,https://shamystores.com/products/yesido-c226-phone-cooler,Available,690.0,EGP,Sale price690 EGP,https://shamystores.com/collections/all?page=54,heuristic
2026-06-13T19:17:45.821005+00:00,shamystores.com,YESIDO EK01 Gaming Headset – New,,https://shamystores.com/products/yesido-ek01-gaming-headset,Available,1190.0,EGP,"Sale price1,190 EGP",https://shamystores.com/collections/all?page=54,heuristic
2026-06-13T19:19:16.648607+00:00,shamystores.com,Buy Controller Performance Thumb Grips in Egypt | Shamy Stores,,https://shamystores.com/products/controller-performance-thumb-grips-41014003056437,Available,175.0,EGP,Sale price175 EGP,https://shamystores.com/collections/accessories?page=1,heuristic
2026-06-13T19:19:16.674978+00:00,shamystores.com,Buy Onikuma K1b Gaming Headset in Egypt | Shamy Stores,,https://shamystores.com/products/onikuma-k1b-gaming-headset-41014003057239,Available,690.0,EGP,Sale price690 EGP,https://shamystores.com/collections/accessories?page=1,heuristic
2026-06-13T19:20:01.959105+00:00,shamystores.com,Buy Baseus Cloud Gel Protective Case for Airpods Pro in Egypt | Shamy Stores,,https://shamystores.com/products/baseus-cloud-gel-protective-case-for-airpods-pro,Available,240.0,EGP,Sale price240 EGP,https://shamystores.com/collections/accessories?page=4,heuristic
2026-06-13T19:20:01.992021+00:00,shamystores.com,Buy Controller Charging Stand in Egypt | Shamy Stores,,https://shamystores.com/products/controller-charging-stand-041014003055982,Out of Stock,120.0,EGP,Sale price120 EGP,https://shamystores.com/collections/accessories?page=4,heuristic
2026-06-13T19:20:02.048262+00:00,shamystores.com,Buy Redragon K565 Rudra Rainbow Mechanical Gaming Keyboard in Egypt | Shamy Stores,,https://shamystores.com/products/redragon-k565-rudra-rainbow-mechanical-gaming-keyboard-41010003057737,Out of Stock,590.0,EGP,Sale price590 EGP,https://shamystores.com/collections/accessories?page=4,heuristic
2026-06-13T19:20:02.064009+00:00,shamystores.com,Buy Redragon K552 Kumara Led Backlit Mechanical Gaming Keyboard in Egypt | Shamy Stores,,https://shamystores.com/products/redragon-k552-kumara-led-backlit-mechanical-gaming-keyboard,Out of Stock,1890.0,EGP,"Sale price1,890 EGP",https://shamystores.com/collections/accessories?page=4,heuristic
2026-06-13T19:20:02.072286+00:00,shamystores.com,Save 100 Sale price Regular price Anker PowerLine Select+ Lightning Cable Black (6ft) Anker Sold out Sold out Quick view,,https://shamystores.com/products/anker-powerline-select-lightning-cable-black-6ft,Out of Stock,290.0,EGP,Sale price290 EGP,https://shamystores.com/collections/accessories?page=4,heuristic
2026-06-13T19:20:47.378365+00:00,shamystores.com,Buy Redragon Phaser M609 Gaming Mouse in Egypt | Shamy Stores,,https://shamystores.com/products/redragon-phaser-m609-gaming-mouse-41010003057988,Out of Stock,690.0,EGP,Sale price690 EGP,https://shamystores.com/collections/accessories?page=5,heuristic
2026-06-13T19:20:47.382286+00:00,shamystores.com,Buy Onikuma K8 Headset in Egypt | Shamy Stores,,https://shamystores.com/products/onikuma-k8-headset,Out of Stock,890.0,EGP,Sale price890 EGP,https://shamystores.com/collections/accessories?page=5,heuristic
2026-06-13T19:20:47.386184+00:00,shamystores.com,Buy Cable Hdmi Normal 5m in Egypt | Shamy Stores,,https://shamystores.com/products/cable-hdmi-normal-5m-4102060,Out of Stock,120.0,EGP,Sale price120 EGP,https://shamystores.com/collections/accessories?page=5,heuristic
2026-06-13T19:20:47.415486+00:00,shamystores.com,Buy Ac Adapter Dobe for Switch in Egypt | Shamy Stores,,https://shamystores.com/products/ac-adapter-dobe-for-switch-tns-5159,Out of Stock,450.0,EGP,Sale price450 EGP,https://shamystores.com/collections/accessories?page=5,heuristic
2026-06-13T19:20:47.429218+00:00,shamystores.com,Buy Dobe Storage Case for Switch 2 in Egypt | Shamy Stores,,https://shamystores.com/products/obe-storage-case-switch-2,Out of Stock,1690.0,EGP,"Sale price1,690 EGP",https://shamystores.com/collections/accessories?page=5,heuristic
2026-06-13T19:37:23.184875+00:00,compumarts.com,Xigmatek Prime M 1000W 80 Plus Gold ATX 3.1 PCIe 5.1 Full Modular Power Supply with DC to DC Convertor Design and OCP UVP OVP SCP OPP OTP Protection,,https://compumarts.com/collections/new-arrivel-accessories-%F0%9F%8E%A7/products/products-xigmatek-prime-m-1000w-80-plus-gold-atx-3-1-pcie-5-1-full-modular-power-supply,Available,1000.0,EGP,Xigmatek Prime M 1000W 80 Plus Gold ATX 3.1 PCIe 5.1 Full Modular Power Supply with DC to DC Convertor Design and OCP UVP OVP SCP OPP OTP Protection,https://compumarts.com,heuristic
2026-06-13T19:37:23.233728+00:00,compumarts.com,Xigmatek Prime M 850W ATX 3.1 850W Full Modular Power Supply,,https://compumarts.com/collections/new-arrivel-accessories-%F0%9F%8E%A7/products/xigmatek-prime-m-850w-atx-3-1-full-modular-power-supply,Available,850.0,EGP,Xigmatek Prime M 850W ATX 3.1 850W Full Modular Power Supply,https://compumarts.com,heuristic
2026-06-13T19:37:23.243156+00:00,compumarts.com,MAONO PM450S Condenser Microphone USB USB Type-C Unidirectional Microphone with Real-Time Monitoring Shock Mount Boom Arm and Monitor Mix Controls,,https://compumarts.com/collections/new-arrivel-accessories-%F0%9F%8E%A7/products/products-maono-pm450s-usb-usb-type-c-unidirectional-condenser-microphone,Available,450.0,EGP,MAONO PM450S Condenser Microphone USB USB Type-C Unidirectional Microphone with Real-Time Monitoring Shock Mount Boom Arm and Monitor Mix Controls,https://compumarts.com,heuristic
2026-06-13T19:37:23.245748+00:00,compumarts.com,MAONO AU-MH700 Gaming Headphones Black Close Back Over Ear Headset 32 Ohms Impedance Over Ear Design,,https://compumarts.com/collections/new-arrivel-accessories-%F0%9F%8E%A7/products/products-maono-mh700-black-close-back-over-ear-32-ohms-gaming-headphones,Available,700.0,EGP,MAONO AU-MH700 Gaming Headphones Black Close Back Over Ear Headset 32 Ohms Impedance Over Ear Design,https://compumarts.com,heuristic
2026-06-13T19:37:23.249869+00:00,compumarts.com,"MAONO PD400X Multi-Functional XLR/USB Dual-Mode Dynamic Microphone with 3-in-1 Digital Control, Tap to Mute, Unidirectional Polar Pattern for Podcasting Recording Streaming and Singing",,https://compumarts.com/collections/new-arrivel-accessories-%F0%9F%8E%A7/products/products-maono-pd400x-usb-xlr-unidirectional-dynamic-microphone,Available,400.0,EGP,"MAONO PD400X Multi-Functional XLR/USB Dual-Mode Dynamic Microphone with 3-in-1 Digital Control, Tap to Mute, Unidirectional Polar Pattern for Podcasting Recording Streaming and Singing",https://compumarts.com,heuristic
2026-06-13T19:37:23.255313+00:00,compumarts.com,MAONO PD300X Dynamic Microphone 192kHz 24-bit Audio Resolution Built-in Noise Reduction Podcasting Streaming Recording Microphone,,https://compumarts.com/collections/new-arrivel-accessories-%F0%9F%8E%A7/products/products-maono-pd300x-192khz-24-bit-noise-reduction-dynamic-microphone,Available,300.0,EGP,MAONO PD300X Dynamic Microphone 192kHz 24-bit Audio Resolution Built-in Noise Reduction Podcasting Streaming Recording Microphone,https://compumarts.com,heuristic
2026-06-13T19:37:23.361568+00:00,compumarts.com,Xigmatek Prime M 1000W 80 Plus Gold ATX 3.1 PCIe 5.1 Full Modular Power Supply with DC to DC Convertor Design and OCP UVP OVP SCP OPP OTP Protection,,https://compumarts.com/collections/new-arrivel-accessories-%F0%9F%8E%A7/products/products-xigmatek-prime-m-1000w-80-plus-gold-atx-3-1-pcie-5-1-full-modular-power-supply,Available,1000.0,EGP,Xigmatek Prime M 1000W 80 Plus Gold ATX 3.1 PCIe 5.1 Full Modular Power Supply with DC to DC Convertor Design and OCP UVP OVP SCP OPP OTP Protection,https://compumarts.com,heuristic
2026-06-13T19:37:23.410334+00:00,compumarts.com,Xigmatek Prime M 850W ATX 3.1 850W Full Modular Power Supply,,https://compumarts.com/collections/new-arrivel-accessories-%F0%9F%8E%A7/products/xigmatek-prime-m-850w-atx-3-1-full-modular-power-supply,Available,850.0,EGP,Xigmatek Prime M 850W ATX 3.1 850W Full Modular Power Supply,https://compumarts.com,heuristic
2026-06-13T19:37:23.419696+00:00,compumarts.com,MAONO PM450S Condenser Microphone USB USB Type-C Unidirectional Microphone with Real-Time Monitoring Shock Mount Boom Arm and Monitor Mix Controls,,https://compumarts.com/collections/new-arrivel-accessories-%F0%9F%8E%A7/products/products-maono-pm450s-usb-usb-type-c-unidirectional-condenser-microphone,Available,450.0,EGP,MAONO PM450S Condenser Microphone USB USB Type-C Unidirectional Microphone with Real-Time Monitoring Shock Mount Boom Arm and Monitor Mix Controls,https://compumarts.com,heuristic
2026-06-13T19:37:23.422284+00:00,compumarts.com,MAONO AU-MH700 Gaming Headphones Black Close Back Over Ear Headset 32 Ohms Impedance Over Ear Design,,https://compumarts.com/collections/new-arrivel-accessories-%F0%9F%8E%A7/products/products-maono-mh700-black-close-back-over-ear-32-ohms-gaming-headphones,Available,700.0,EGP,MAONO AU-MH700 Gaming Headphones Black Close Back Over Ear Headset 32 Ohms Impedance Over Ear Design,https://compumarts.com,heuristic
2026-06-13T19:37:23.426404+00:00,compumarts.com,"MAONO PD400X Multi-Functional XLR/USB Dual-Mode Dynamic Microphone with 3-in-1 Digital Control, Tap to Mute, Unidirectional Polar Pattern for Podcasting Recording Streaming and Singing",,https://compumarts.com/collections/new-arrivel-accessories-%F0%9F%8E%A7/products/products-maono-pd400x-usb-xlr-unidirectional-dynamic-microphone,Available,400.0,EGP,"MAONO PD400X Multi-Functional XLR/USB Dual-Mode Dynamic Microphone with 3-in-1 Digital Control, Tap to Mute, Unidirectional Polar Pattern for Podcasting Recording Streaming and Singing",https://compumarts.com,heuristic
2026-06-13T19:37:23.431845+00:00,compumarts.com,MAONO PD300X Dynamic Microphone 192kHz 24-bit Audio Resolution Built-in Noise Reduction Podcasting Streaming Recording Microphone,,https://compumarts.com/collections/new-arrivel-accessories-%F0%9F%8E%A7/products/products-maono-pd300x-192khz-24-bit-noise-reduction-dynamic-microphone,Available,300.0,EGP,MAONO PD300X Dynamic Microphone 192kHz 24-bit Audio Resolution Built-in Noise Reduction Podcasting Streaming Recording Microphone,https://compumarts.com,heuristic
